Show me my meetings this Friday,query
whats the news about in africa,query
What are the latest crime statistics for my area,query
Any new mail since last time,query
"If I go outside, will I need a hat and gloves?",query
will the temperature be higher than 40 tomorrow?,query
How cold is the weather right now?,query
What is the mayor's stance on homelessness in Seattle?,query
what time,query
Check new emails in the last day,query
Weather in Atlanta,query
list all the lists on this device.,query
Are there any tornado warnings today?,query
Give me recent emails.,query
Do i need  a jacket in the evening,query
Are there any unread emails from Patrick?,query
bing up my list,query
todays news,query
what to i have a my to do list,query
olly tell me my alarms,query
i finished my to do list,query
what are the probability that it will rain today?,query
Who have emailed me recently and what are the subjects of each email?,query
Send me links to news articles about the protest.,query
update me,query
What's the best way to Sheffield?,query
How is this song titled?,query
Give me the current date,query
what time is it?,query
did I received an email from rohit?,query
I AM NEED OF AN EVENING RAIN COAT,query
"Hey Google, what is on my alarm schedule?",query
Read me the newest article on the new solar system.,query
what is month in my calender?,query
Is there any new unread Yahoo email?,query
Political news of importance for the day,query
"Will you tell me what time it is in Cloverdale, Indiana?",query
What is the interval of train departures in Chicago?,query
climate details now,query
"Olly, do I need to wear boots?",query
Do they deliver?,query
What is that song playing in the background?,query
what album is this song on,query
What are my current alerts?,query
Did anyone get engaged or give birth among my online friends?,query
"PDA, does that restaurant allow call-in orders?",query
do i have any emails about chemistry,query
Do I have any events scheduled today?,query
weather news,query
how many muhurtham in this month?,query
Tell me about my alarms,query
Notification regarding the new iphone release update,query
Has John replied to my Facebook post?,query
what is the status of my order no?,query
How many new emails for this week?,query
sunset temperature today,query
Follow news about Hilary email issue in future.,query
PDA what's on my to-do list?,query
What is the status on my latest order?,query
Which grocery stores have I mad a list with?,query
Have I gotten any mail recently?,query
Please list all my alarms,query
Tell me the song track,query
PDA what time is time?,query
Search cost for Amtrak Luxury to Los Angeles,query
With whom do I have appointment today,query
Pull up all outgoing emails from yesterday.,query
get new emails,query
What time is there a train going from Prague to Brno?,query
What is the route to the closest mcdonalds?,query
"PDA, show me my calendar.",query
What is the latest update on the weather in Harrisburg Pennsylvania?,query
How is the weather like today,query
Get me the news about today's meeting,query
Read shopping list items.,query
What is the date next Wednesday?,query
What is the current time right now?,query
How will be the weather today in the afternoon,query
How much time do I have left until the pta meeting?,query
do I have a dentist appointment on Monday morning?,query
"What time does the train run in Beaumont, Tx?",query
Give me the shopping list.,query
display date,query
What is the temperature?,query
hey siri tell my today's top news,query
What is the weather like today?,query
do i have any openings on my schedule for tomorrow,query
Daily news from source,query
Tell me international news.,query
what day is the 22nd,query
How Many food items on the list,query
"Yesterday at noontime, in Times Square, what was the protest about?",query
upcoming events information,query
Are there any recent e-mails in my inbox from my boss?,query
Should I take an umbrella?,query
"i want some curry to go, any recommendations olly?",query
what is on my schedule for 9 to 11am tomorrow?,query
What events do I have between 12pm and 4 pm?,query
How many new emails are there in my Gmail?,query
Please show me any articles related to weather in the morning news.,query
headlines from Dhaka tribune,query
What date is tomorrow,query
PLEASE TELL WHAT WOULD BE THE WEATHER IN WASHINGTON DC FOR THE COMING WEEK.,query
What's that the album is current music from?,query
RCCG ikoyi Lagos distance by train will take how long and which direction?,query
"How warm is it in Columbus, Ohio?",query
pull up trump stories,query
evens please,query
Read what is on my list.,query
how many hours remaining for mid noon.,query
Any new email from the boss?,query
What went on in the world today?,query
Have I gotten any emails in the last day?,query
manoeuvres,query
what's the current temperature outside,query
Does it fall a sunday on 5th december?,query
are there any new emails from NAME,query
Whats the weather in Minneapolis,query
check email for new messages,query
What time is the train to San francisco due?,query
How is the current weather in California.,query
Am I scheduled to do anything on x day?,query
What's the humidity level?,query
"How cold is it in Anchorage, Alaska?",query
"PDA, id my appointment with Sara [date : tomorrow]?",query
Is this true about this date?,query
did I get anything new from my boss?,query
Do I have any events set?,query
Can I plan basketball match in the evening,query
What's going on in the world right now?,query
Will it be raining tomorrow.,query
I HAVE REPORT ANY OF THE PDA'S,query
Is it snowing in Seattle?,query
what is the weather in this week,query
list all pending reminders,query
"Hey PDA, Did i get any new emails?",query
What time is the next event scheduled?,query
What is the date Easter falls on?,query
"What is the weather next week in Pasadena, CA?",query
Will it rain in the evening today,query
What is today's current date?,query
"PDA, whats my schedule today",query
People canceling Iowa vacations over congressman's words,query
"Do I have any new messages in twitter, Instagram, or Facebook?",query
please check my mails,query
"Hey PDA, What are my lists?",query
news updates,query
Do I need my raingear?,query
What are the headlines from the new york times,query
Any new mail from jack,query
what did ben email me,query
open news about BP Oil,query
What's on my list to do today?,query
How many corporate meetings do i have this week?,query
what is the forecast?,query
What chances are of snowfall this month.,query
Can I please have the weather for tomorrow here in Costa Mesa?,query
Show the list of upcoming events,query
Please Check all new email of Amazon.,query
What is the current temperture in my area.,query
"When is the last departing train from Boston, Massachusetts.",query
How often does the train arrive and depart from Penn Station?,query
Could you check the reminders and tell me what are pending?,query
Olly Hackernews,query
show me recent news on particular subject,query
Read what lists I have,query
Is it hot and muggy or warm and humid in the bayou today?,query
How will be the weather today in the evening,query
What was the scores between OKC and DEN?,query
Describe the list contents,query
What date is it?,query
Please give me update of cricket,query
"PDA, What music is being played right now?",query
give me the news update from BBC,query
What's the name of the piece you are playing?,query
What meetings do I have between 8-10 today?,query
Check emails from mom,query
Please tell me whether there is a new mail from jay ?,query
Find new Trump articles but not from Fox News.,query
can you check the facts on this issue,query
are all programs in line,query
Is tonight the full moon?,query
What alarms are set for this week Echo.,query
local news from bay news 9,query
can you give me local news on wayne county sheriffs?,query
File Downloading,query
what's new in gaming industry?,query
Is there any event today in my calendar?,query
get contact,query
"Olly, find me the latest news right now",query
Tell me how to get from here to The Chimes in Covington,query
Did i receive any e-mails from contact about subject?,query
Give me information about this song,query
date and time,query
please take me to Wall Street journal,query
"Olly, what is the newest news right now?",query
What is the latest news from Syria?,query
When did pop it like it's hot come out?,query
10.02.2017,query
What is the current song called?,query
Check to see if I have any new emails from...,query
Give me the news,query
How do I get to church?,query
COULD YOU PLEASE TELL ME WHAT IS THE WEATHER PREDICATION FOR THIS WEEK.,query
What's on the New York Time?,query
what is the title of the song?,query
Any new messages?,query
google translate,query
WHAT IS THE DATE NEXT SATURDAY?,query
Is Fox News reporting any breaking news at this time?,query
Say the time,query
The date today please,query
Name all lists,query
can I wear sandals,query
Is there anything new in my gmail?,query
CAN TO PLAY CCN NEWS FOR ME?,query
tell me what weather is outside,query
tell me about the list.,query
Tell me about this song.,query
Show me what time it is!,query
Please tell me what lists I have made.,query
who is singing this song,query
What is the status on my takeout?,query
What is the weather in Paris?,query
Check my inbox,query
Show me all meeting reminder,query
Latest TV show news,query
give me directions to the nearest mcdonald's,query
Will I need my heavy coat after lunch today?,query
Do I have any new emails in the last hour?,query
Whats on your list right now?,query
Do I need to wear sunscreen today?,query
I want to get the latest news on the Trump Healthcare bill.,query
Show me my last email?,query
Am I free this Saturday?,query
Do I have a 2pm appointment,query
do i have an alarm set for today,query
What is the title of the song that is playing?,query
what is the weather update for tuesday,query
"Olly, what day is Easter this year?",query
Tell me time it is.,query
Hey what is the weather like today,query
When will team meeting start,query
Time now in New York.,query
"Olly, please read me my current lists.",query
Please refresh my Gmail inbox,query
Did Linda Connors reply to any of my emails this morning?,query
how to repeat the song,query
Display available lists,query
When is the next SEPTA train to Philadelphia?,query
Tell me when there is new news about Donald Trump,query
What do I have going on today?,query
what information do i have on reminders,query
what song is playing,query
When does my train leave?,query
bbc live,query
What is today's weather in Springfield?,query
"PDA, have I gotten any new emails from ****?",query
Tell me latest technology news.,query
Update status of ...,query
What news do you have today?,query
What is the departure time for the next train leaving New York City?,query
Do I have anything on my to-do list?,query
Did Paul email me recently?,query
Can you tell me about the alarm called 'Bed'?,query
Please find events in the month of March,query
Do I have anything on this date?,query
Does that restaurant deliver?,query
what are my engagements today?,query
PDA will I need my sun glasses today?,query
What is my email from Steve about?,query
what is the weather like in new york,query
what's the time in australia,query
"What day of the week was December 4, 1982?",query
How many likes does my status from yesterday have?,query
Please tell me the latest news about the election scenario in our state.,query
Is Wyatt's birthday party at 10pm?,query
"PDA, Will I need sunscreen later?",query
who sings that song?,query
"Please find a email from my friend, Tiffany",query
PLEASE TELL ME WHAT WILL BE RAINY DAY BASED ON THE WEATHER FORCAST/,query
Any new emails in my inbox?,query
What time is it in London?,query
read freds emails,query
global warming,query
my party list,query
Open news,query
Which song is this one?,query
"Is there any rap that doesn't involve sex, money and drugs?",query
will it be rainy tomorrow?,query
open all unread emails,query
Tell me the current weather in New York city,query
Was there an appointment set up for Saturday?,query
Do I have free time next Tuesday to schedule a meeting?,query
Breaking news Fox News,query
Tell me what happened today from 8am to 9am.,query
Does my favorite restaurant do delivery?,query
Open facebook messenger,query
Facebook,query
What was the subject of my last email to Tom?,query
Do you have any news from News provides,query
if there news about u.p politics.what is that.,query
Please check third event of 22/03/2017,query
show albums of rihana,query
what music is this?,query
"What's the current time in Orlando, FL?",query
What time is (event) starting?,query
Can I carry out with this restaurant?,query
weather in home town,query
News headlines,query
how is president's trump office proceeding?,query
Does Louie's do take out,query
"Hello,  I would liek to know whether you provide home delivery services?",query
What does my schedule look like after 3 p.m. today afternoon?,query
"Fire in Columbus, Ohio.",query
Show me news about Trump,query
PDA please tell me the name of this song that is currently playing.,query
What is the current time in Hong Kong?,query
Does Peking Garden take orders over the phone?,query
Is it going to rain on Friday?,query
buying clothes,query
What alarms do I all have set,query
What does the email say that was sent 30 minutes ago from Mom.,query
Is it still going to be rainy and cold on Wednesday?,query
how is the news in ireland?,query
What time is it in pacific time,query
Read me a news article about Jeff Sessions.,query
pull up list,query
Give me the latest population statistics for Donald Trump,query
Do I have anything booked for tomorrow?,query
Brief me about  today's football match,query
Any news updates from BBC?,query
Are there team meetups on the schedule this month?,query
Tell me the date of inauguration of my friend Sams business,query
weather this weekend,query
check if default alarm is set,query
What meetings occurred between january 1 and january 12,query
What time is it now in GMT?,query
What lists have I created?,query
Is there a train from Philadelphia to New York City at noon?,query
emails in the last 10 minutes,query
is there a chance of snow wednesday?,query
What is the latest headline news from this newsource,query
schedule for this weekend,query
who is the latest sender?,query
can you tell me my reminders today,query
Do I have any new emails from...?,query
Greeting of the day and PDA states date after greeting,query
When does the F train run today?,query
Please Alexa tell me latest video going viral on twitter for topic Narendra Modi,query
song info,query
find out the public holidays this month,query
please show me weather on monday,query
My list please.,query
29th march comes on what day?,query
Will the pizza be here soon?,query
Whats on my list  agenda for the time being,query
aljazeera today news,query
will there be ash in the sky in LA today,query
Bring up the latest headlines from Huffpo.,query
What's my calendar today,query
What was last sent to me in my social media feed?,query
What is latest news about Donald Trump? Tell me about controversial statements of Donald Trump.,query
How many calories did I burn between 3 and 5 today?,query
Myspace,query
What the singer meant by the title of the song Bohemian Rhapsody?,query
What are the headlines on the New York Times?,query
Who sang the song that is currently playing?,query
what song is this,query
Within the past 3 months how many meeting did I have with Mr. Richards,query
i need to check today's email of jack,query
Give me the local time of London,query
Have I gotten any new emails from family/,query
What is the current weather condition in my place,query
When will my dinner with Max scheduled to happen?,query
What news has happened on CNN today?,query
Does Pings have takeaway?,query
What are today's headlines?,query
Did i set an alarm to have tablets in the noon?,query
Olly do I have any emails from Robert,query
What's the best day next week to go out for pizza?,query
"Olly, what's new in the news?!",query
climate,query
When is the next board meeting?,query
"Olly, do you have any local news?",query
Should I bring a coat?,query
Please find today's forecast,query
How many lists do I have in contacts?,query
What is my afternoon schedule tomorrow?,query
where is the meeting tomorrow at 4pm,query
any lighting news emails,query
today get umberrlow,query
I have new email.,query
Ask your Network,query
Whats on my calendar today,query
what time is it Eastern,query
Do I have a doctor's appointment in my calendar?,query
what's trending,query
search email for contact,query
What CD is this song on?,query
"Time, Wellington, NZ",query
list my today's meeting,query
How much for a train ticket?,query
What will the weather be like in Oklahoma City on Monday,query
Olly what do I need to get done today?,query
Who is this on the radio?,query
Recent tech headlines,query
bbc breaking news,query
what is the weather near me this week,query
chance of rain in % for [date : tomorrow],query
How is the weather looking in Las Angeles?,query
what is my schedule like today,query
What are listed?,query
please check if there is a new email on the inbox,query
"Is it cloudy today, Is the wind calm today",query
when was this song released,query
tell me  the details of the music playing,query
Where is baseball practice happening tomorrow?,query
What's was the upcoming event,query
check my emails for something from NAME,query
directions,query
check my mail,query
Tell me the current time in Central time.,query
can i know what i on the list,query
How long will my lunch meeting be on Tuesday?,query
when is the next appointment,query
When is the school dance junction marked,query
Plesae let me know the current time at New York,query
"PDA, train time from brooklyn to queens.",query
Show latest news about migration,query
tell me the date today,query
What's the latest news involving Katy Perry?,query
Physical education drill Marilyn,query
Listen to Girl from Impanema by Frank Sinatra,music
Please replay that song I just listened to.,music
can you play music by pink floyd?,music
d,music
choose music player,music
Make a playlist of music from artists on the Exodus CD,music
Can you open my itunes?,music
play new bob dylan album,music
Play dev43 song by frubs artist,music
Listen to x playlist next,music
Hey olly play the latest somgs from playlist,music
song next please,music
"PDA, play my pop playlist.",music
please let me hear 666 the number of the beast,music
Can you play me some dance music.,music
Que song Let it Burn,music
Play me songs of genre,music
Play music by queen.,music
Select and play only christian rock from 1990 upwards.,music
Play Bilando,music
1980's rock,music
play playlist number 7,music
thankama,music
Please play music.,music
I want to listen to up beat music.,music
"Play, Atmosphere next.",music
play my most played playlist,music
Play classic rock,music
play songs by coldplay,music
Play me something pop,music
Play my all time favorite songs,music
Please play my Top Music playlist.,music
Remind me to play this song tonight.,music
"Play Maroon 5, Moves Like Jagger",music
"PDA, I'd like to listen to Poker Face by Lady Gaga",music
Alexa play my country playlist.,music
Play all my favorite latin songs.,music
Play my favorite song by London Grammar.,music
"PDA, play Poker Face by Lady Gaga",music
Please play my 90's rap hits,music
Play my favorite playlist,music
Pull up my party palylist.,music
Play my rock playlist.,music
Play last song from my favourite playlist.,music
Christian rock from 1990 upwards only should be selected and played.,music
Play some tracks by Michael Jackson.,music
Arrange and play all songs of Eminem.,music
Please play Michael Jackson album,music
Start the Dogwalking playlist.,music
start playlist,music
Between 1990 and 2000 music album is only to be played.,music
Make a Jars of Clay playlist for me,music
play {song title} by {artist},music
Open the playlist,music
play the song which is in movie rangoon.,music
Find me all music for classical music.,music
Play music by the Beatles.,music
paly the playlist,music
"Play only songs by the Beatles, please.",music
"music, Third Day",music
play a random song from my playlist.,music
Open my playlist,music
Play me some music,music
open a song from the given list,music
play previous song,music
Time to workout,music
Play my music,music
PDA play slayer.,music
Play the Billboard top 10.,music
play the song let it go,music
"Olly, play jumper by third eye blind.",music
"Olly deathmetal, now!",music
please play me a song from my fevorate list,music
will you play music for me/,music
Play Major Tom by David Bowie,music
put a disco track,music
I would love to hear the playlist I created for my wedding.,music
Please play the song XXX for me.,music
Play for me the music by Michael Jackson,music
Play the new record of Malika,music
play Madonna now,music
Play Kanye West playlist,music
Play Bad Religion folder,music
get the beat,music
Can you turn on country music?,music
Select the R&B playlist from the 90's please.,music
I'd like to hear some oldies songs.,music
Let me hear some pop music or a song,music
PDA add Gold Digger to queue,music
Play my favorite song from last year.,music
"Assistant, shuffle entire library",music
can you play my last song,music
"Hello Google, Play Baby One More Time.",music
play a song of your choice for me,music
Play music of Kate Perry without shuffle.,music
Can you play some Jazz,music
i want to hear the songs of Adele,music
Play it again please,music
play spotify playlsit blank,music
Play music on shuffle,music
Can you play the instrumentals of,music
Open Bad Religion folder,music
can you play {song title} by {artist},music
Please resume my music,music
"play music composed by some one, giving short hint about the album.",music
Coordinate all pop song genres,music
play only My list,music
Play my Rap playlist,music
Google I wanted to hear my country music playlist.,music
PDA name: can you play my favorite music,music
Start playing my song list.,music
"PDA: I want some music, how about playing my workout playlist",music
Olly play Believer,music
Play something romantic,music
Play songs by the band The Beatles,music
Ennavale adi ennavale,music
play gaga playlist,music
I want to hear some tunes,music
Play pop music.,music
Play one through ten on U2 list,music
Play my playlist starting from the bottom.,music
Play all songs on shuffle,music
please play all the songs in high volume and make adjustments to pop music mode.,music
Hey Google play some jazz music for me.,music
Play playlist Postal Service.,music
play sholay,music
Please play shape of you by Ed Sheeran.,music
Play list of music from avatar,music
Please play a song by Bruno Mars.,music
alexa play classic rock,music
play album,music
"Ok Google, start reggae music",music
I would like to hear the song Aces High,music
Play the song I listen to the most,music
Put a record on,music
Play Hurt by Johnny Cash next.,music
stream all songs from 'rock',music
play first song on next album,music
Play <song name>,music
play music for me,music
Start playing Bag of Hammers,music
Play playlist 1,music
PDA play my workout playlist.,music
"Hey Olly, play me a popular R&B song?",music
Play Ella Fitzgerals Get Happy,music
Play my Morning playIst,music
Please find music by AFI,music
"I feel like Jazz right now, how about you?",music
"I need a good cry, can you play me sad rock songs?",music
please play help,music
Start playing music.,music
Shuffle my workout playlist,music
Play top 40 dance,music
purple haze,music
get played the latest classic music,music
Open my classical playlist.,music
"Olly, play anything in my recent playlist.",music
"Alexa, Play my favorites.",music
play rehab song,music
Play Michael Buble Save the Last Dance,music
play True Love next,music
I want to listen to the Beatles Greatest Hits.,music
vanilli marauthr,music
Play Raindrops Keep Fallin On My Head next please.,music
"Strings and pianos, but only accoustical guitar not electric please.",music
please play 13,music
"pause, put this song on after this song",music
Shazam,music
Play my chillhop playlist,music
Comfort my ears with Arijit Singh,music
Play Human nature of Michael Jackson,music
Play 'Uptown Girl' by Billy Joel,music
Play a song i like.,music
Hey olly play playlist tactics from music,music
Get me some music,music
play something by The Used.,music
"Alexa, please play the song Over the rainbow",music
play a song randomly from my playlist,music
play soft instrumental songs,music
Can you play some Elvis for me?,music
play music from my favorite artist,music
Play my Spotify Dance Play List,music
"Olly, I need to hear Notorious Thugs by Bone Thugs now.",music
I want to find some good rock music.,music
Put on Cannibal Queen,music
play songs from my playlist,music
Play the BeyoncΓö£┬« playIist,music
let me hear some bluegrass music,music
Please start playing my Youtube playlist.,music
Can you play AR Rahman music,music
Play Jazz from Jennifer's latest album,music
Can you play 24K Magic by Bruno Mars?,music
Please play Candle in the Wind.,music
Please crank up Huey Lewis and The News.,music
Turn on some music!,music
Hit random on my most liked songs.,music
Play my motivational playlist.,music
I want to hear Snow by Red Hot Chili Peppers,music
Play Me the latest song of Adele,music
I would like to hear Heathens by Twenty one Pilots.,music
select rai music file,music
Play the first song on my Playlist,music
Play music by Taylor Swift,music
play music from where you left off,music
Play music from the jazz genre.,music
Will you put on the music ?,music
Play the last played playlist,music
"Play my Killers playlist, please.",music
"PDA, stream Poker Face by Lady Gaga",music
play me a recent cover of cherry bomb,music
please play this song,music
Play jingle bells,music
switch to the song from album,music
Time to hear me some Blake Shelton,music
