cancel next meeting,remove
Please earse the next birthday event,remove
November event delete,remove
cut red peppers from groceries,remove
Please remove this list,remove
Ask them to remember always to lock the door and keep a careful watch on their keys.,remove
Remove all events from my calendar.,remove
remove next event calendar,remove
In my calendar delete all of my golf events for the current month.,remove
Erase all events on the calendar.,remove
disable the alarm which is set at 9:30pm,remove
Get rid of my wake up alarm set for Saturday.,remove
Cancel all my appointments after 3 p.m today and inform me the details.,remove
remove,remove
remove {item} from list,remove
Echo clean out my calendar delete everything.,remove
I no longer need the daily 5pm alarm.,remove
remove last played song,remove
Remove vegetables from the list,remove
erase,remove
"Kickball is over, I do not need the alarm for kickball on Wednesday evening, any longer.",remove
Remove that item,remove
Get rid of bananas on the list,remove
Clear my calendar for Saturday,remove
Take off item 3,remove
Remove no. 3 alarm of list.,remove
Cancel appointment for 3rd of April,remove
Remove all the events in my calendar,remove
remove my morning alarm,remove
Forward email to liz,sendemail
Send an email to Scott asking what the weather will be like this week.,sendemail
pleas replay to the mail of Allen,sendemail
Send mail to Bubbles. I want to meet her tomorrow at 2 PM in office.,sendemail
Please send a voice mail to Mr. Richard office about meting him on 1/2/2017 at 5 pm.,sendemail
answer this mail.,sendemail
Pull up Kate's email and write that I will let her know.,sendemail
send response I will be there,sendemail
PDA: Tell Bob Smith...,sendemail
Please email to my wife about next week weather,sendemail
Send an email to qerwerq@dfasdfa.com,sendemail
Type an email for me please.,sendemail
Could you please email John saying I'm on Leave,sendemail
"Compose a new email, but I got a new address this time, brandon at example dot com",sendemail
There is an e-mail I need you to send my friend,sendemail
Please Send an email to toms principal in regards to the meeting we have tomorrow.,sendemail
Compose an email to Bob,sendemail
Create email to John start body I am interested in seeing the car you have for sale can we schedule a time to meet? Send,sendemail
Alexa start email.,sendemail
Send an email to Ray,sendemail
Send email to Elain and reminder her not to forget the oranges in the morning,sendemail
Reply to Beth's email tomorrow by telling her I wont be late,sendemail
Send an email to grandma saying we are dropping by on Saturday. See you then!,sendemail
Please load new e-mail for Bruce and send message now.,sendemail
Send an email to my brother and say wedding anniversary,sendemail
"HEY, SEND AN EMAIL TO MY FRIEND",sendemail
through outlook,sendemail
I need to edit Marie Jones' email address to read jonesm1980@yahoo.com.,sendemail
"Alexa, email mom and ask how the weather is there",sendemail
Reply an Email to Jason that I will not come tonight,sendemail
send voice email,sendemail
I need to reply to this email.,sendemail
Send an email to Frank at work.,sendemail
Send an email to test1@gmail.com with the subject as test and no content.,sendemail
"add mail id, subject , content",sendemail
reply 'thank you' to john@gmail.com,sendemail
Reply to most recent email,sendemail
PDA send email to Carl that I will be late for work tomorrow.,sendemail
Please reply to my most recent email.,sendemail
Send an email to my wife about next week weather,sendemail
Send an email to Dad about the weather for the week.,sendemail
Please send email to Liz,sendemail
Reply to Sarah's email.,sendemail
"Send email to grandma, subject, Saturday, message, we are dropping by on Saturday. See you then!",sendemail
email rohit saying 'I am busy tommorow',sendemail
send mail x@x.org,sendemail
Please send the email to Jeff.,sendemail
email 'happy new year' to john,sendemail
Send email to...,sendemail
I would like to reply to Sarah's email.,sendemail
Reply to the email received from Peter,sendemail
forward the mail to new e-mail address,sendemail
Google I need to answer that last email.,sendemail
Please Send an email to cassy who is there on my family and friend list.,sendemail
send email to my uncle about situation of current weather.,sendemail
Create e-mail to Yulia,sendemail
Send email to Joy Hey I missed you yesterday want to go out for dinner tonight,sendemail
send reply to joe,sendemail
Send to kmart@shopyourway.com...I am waiting for a response from my earlier email reference number 783543. Any help would be appreciated.,sendemail
write an email,sendemail
"Alexa, please send an email to mom",sendemail
pls send a mail to my hubby i will late tonight,sendemail
Open a new email to contact.,sendemail
how we calcultate,sendemail
Email Karen about the budget meeting,sendemail
Send a happy birthday message to my aunt.,sendemail
Now I need to write an email to my colleague,sendemail
send mail to john for money,sendemail
Send email to Anthony.,sendemail
send an email to my assistant clara to cancel all appointments for tomorrow.,sendemail
please reply to my colleagues mail about his query,sendemail
Send an email to my mom.,sendemail
Send an Email to my mum that I will visit her next weekend.,sendemail
send email to Chris with following content,sendemail
I need to send an email to Laura.,sendemail
Please send the new intern an email.,sendemail
send email to family saying I love you all,sendemail
"reply to Dad, write 'I will be late'",sendemail
send email to current email address,sendemail
jj_nzt@yahoo.com,sendemail
Please start an email for my sister.,sendemail
"I want the email to be sent to my new email address, abc@gmail.com",sendemail
Please send an email to <email address>,sendemail
I need to send an email to,sendemail
Email John saying I'm on Leave,sendemail
lindafancy55@gmail.com,sendemail
Email Chelsea,sendemail
send email to jerry about the meeting,sendemail
"hi,please send mail to sam by evening",sendemail
Email the message Hi come down for dinner tonight to Bro,sendemail
"PDA, compose this email to this new email address",sendemail
"I have a new email address, can you send an email?",sendemail
Compose a new email to Ray,sendemail
send alert mail to sandy,sendemail
I'd like to send an email to the new receptionist's email.,sendemail
Can you message back Jean via e-mail.,sendemail
open terry's email,sendemail
Compose new email to <email address>,sendemail
prepare email for susan,sendemail
Open email and send it to,sendemail
Answer email from Sally.,sendemail
Please send Mom an email saying that I can make it next week.,sendemail
Send Ashmit his latest tech topics available.,sendemail
"Hey, please reply to last Pawel's email",sendemail
kishore17051985@gmail.com,sendemail
Echo I just got an email from Bill I need to answer it right now.,sendemail
Respond to the email from John Doe,sendemail
Look up Jim's email and reply that I don't know.,sendemail
Change contact,sendemail
Add new contact and send email,sendemail
Send a reply to that email.,sendemail
Send email to jugal,sendemail
write and send email to my boss,sendemail
send and email to the survey group regarding answers,sendemail
Send an email to sjobs@apple.com,sendemail
Reply to Jason's email with the response 6:30,sendemail
Send a Hi to test2@gmail.com,sendemail
Send Danielle an email.,sendemail
"Email to Matthew with content: Project finished, send me invoice please.",sendemail
will you help me write an email to Chelsea,sendemail
Send to Jane only help,sendemail
Send a reply to Robert for his email received today morning.,sendemail
"OLLY, SEND MOM AN EMAIL TO REMIND HER TO MEET ME FOR LUNCH TODAY",sendemail
Will you send the email to Greg?,sendemail
"Send email to Robert, 'What time is dinner?'",sendemail
Email [name] [contents],sendemail
hi google pls send mail to mom i am comin home on this weekend,sendemail
Reply with [email response].,sendemail
"Send an email to Jerry, ask what time will he be home tonight.",sendemail
Reply to Mark's email.,sendemail
Compose a mail for jack,sendemail
go to contacts and add a new email to the list,sendemail
tell chris i will be late through email,sendemail
"Alexa, email my appointments to reschedule",sendemail
"PDA, please compose a new email to coworker.",sendemail
Can you send an email to 234234@fsdfsd.com?,sendemail
PDA: Reply to Bill's email and add it to my contact list,sendemail
send a mail to Alex asking about the due payment.,sendemail
put a mail to sandy,sendemail
Send a reply to the last email.,sendemail
Respond with...,sendemail
Locate Jen's most recent email so I can reply,sendemail
The email reply should state,sendemail
send email to boss saying I will be late.,sendemail
PDA I need you to respond to Jennifer's email by stating we will be late.,sendemail
Email Tom the date and time of tomorrow's meeting,sendemail
Please respond to the email I just read.,sendemail
Send a copy of the bills to Mecky by email.,sendemail
PDA can you create an email for me.,sendemail
send email to joseph@gmail.com,sendemail
email naty for her birthday,sendemail
Prepare a reply email to Mark.,sendemail
Send a batch of emails to my family,sendemail
can you send email to my friend rohit which says 'I am busy tommorrow.',sendemail
Please send my family an e-mail that says the following :,sendemail
PDA please email,sendemail
Alexa write email.,sendemail
Answer Paul's email.,sendemail
jjj_india@yahoo.com,sendemail
Send an email to my boss and attach the presentation file with it. Apologize for being late.,sendemail
Send email to new contact,sendemail
email friend,sendemail
how its come to us,sendemail
"Open up my sister's email from yesterday, click reply, and turn on voice activation for my response.",sendemail
send 'thank you so much mom' to mom,sendemail
deaft an email to kailey about work later,sendemail
Create an email to my brother asking him what time he will be over for dinner.,sendemail
Email to new contact.,sendemail
Send an email to this contact rede43@oby.com,sendemail
Send email to <email address>,sendemail
Please send Dad an email asking about the weather in New Jersey.,sendemail
I need to email Susan and metion,sendemail
mailed the personal data,sendemail
email the following message to this contact please,sendemail
Send mail to Mom. I am planning vacations with her nest week.,sendemail
"PDA, send that email to James, please.",sendemail
Send email to family and tell them graduation is scheduled for 6PM on Saturday and accept or decline the calendar invite,sendemail
Send an email to Jake to tell him thank you,sendemail
Please draft an email to Shaun requesting Sunday's off for the next schedule.,sendemail
Email staff group distribution about tomorrow's meeting,sendemail
Send email to Mom starting with the subject: Vacation.,sendemail
Begin email to my husband...,sendemail
send email to mommy that i'll be going the party.,sendemail
link 'john@gmail.com' to 'john' in contacts,sendemail
Answer to Pawel's email,sendemail
will you write an email to Chelsea for me,sendemail
Send the following Email to bro Hi come down for dinner tonight,sendemail
new address,sendemail
"Open email to new person, please.",sendemail
send email to [name] saying .... [contents],sendemail
"PDA, could you send that email to Chong?",sendemail
send 'will do. thanks' to john as a reply to his last message,sendemail
"PDA: I need to send a new email, here is the address and then add it to the contact list",sendemail
Email my friend about our plans tonight,sendemail
compose reply,sendemail
send mail to sanantha about body exercise schedule.,sendemail
"Reply the email of Charles with just thank you, right now",sendemail
Send Dad an email saying how is the weather this week?,sendemail
Send email to Mom - Want to go shopping tomorrow?,sendemail
write this message to the coworker group.,sendemail
I want a reply to the email,sendemail
"PDA, please send an email to my family.",sendemail
Let's send an email,sendemail
I want to start my e-mail out like this:,sendemail
i want to send email to my friend jack@gmail.com,sendemail
delete this email,sendemail
"Send an email to Ms. Palmer, ask her if Dean turned in his last homework assignment.",sendemail
Email my meeting details to my manager,sendemail
"send email to daddy, i'll be going to the birthday party.",sendemail
send reply to name,sendemail
Email my mother.,sendemail
Send an email to Peter and ask him how is he now. Can I do something to help him.,sendemail
go to contacts and enter a new email address,sendemail
Send email to Mom and tell her see her at Disney World,sendemail
"Create a new email to a new address, which is brandon at example dot com",sendemail
Alexa compose email.,sendemail
I would like to reply to the most recent email.,sendemail
"Alexa, My friend John has sent me a invitation card to his newly bought home. Say thanks to him in his Mail ID.",sendemail
"HELLO, YOU HAVE A SEND AN EMAIL TO SOMEONE.",sendemail
"Please, send email to Pawel with reminder",sendemail
send email to joanne@aol.com and add as new contact,sendemail
Reply to the email,sendemail
Send a mail to mike. Tell him we will meet today 7 PM for dinner at Coffee House.,sendemail
Send a response to my last email.,sendemail
Send an email to guy selling the boat telling him that I have the money,sendemail
Write email to family member and read it back,sendemail
Send an email to my family wishing them a happy holiday,sendemail
dictate new email,sendemail
Write an email for john@gmail.com,sendemail
Olly that last email needs to be answer asap.,sendemail
reply to johns email,sendemail
I need to add a new email to my contacts.,sendemail
reply to joes email,sendemail
"PDA, send email.",sendemail
Could you please send and email to my friend Susie letting her know I won't be at church tomorrow?,sendemail
open the recent mail of Allen and replay for it,sendemail
mail send to ashok,sendemail
semd email to my contact,sendemail
send 'happy new year' to 'john@gmail.com',sendemail
compose email to a new address,sendemail
Email dad how is the weather this week?,sendemail
Message my mother-in-law to book the reservations before friday or they will expire,sendemail
Send an email to (sender),sendemail
send email to Tim,sendemail
write and send email to friend Cindy,sendemail
Please send a reminder email to Peter and ask him how long he will be taking to prepare the presentation ppt.,sendemail
reply,sendemail
Open my most recent email and reply,sendemail
email my favourite contacts,sendemail
Reply to Erins email by saying I will be on time,sendemail
Send email to GBaby tell her GMa loves her and hopes she has a great weekend,sendemail
Add new email address and send email,sendemail
I'd like to send a reply.,sendemail
email my contact with the following message,sendemail
Email my boss that I will be late today because of an emergency and apologize to him for missing the meeting.,sendemail
Send an email to Julie that I can meet up with her on Saturday at 1PM,sendemail
Send an email to my family telling them about my upcoming birthday plans,sendemail
Send [name] an email that reads .... [contents],sendemail
or you can email to my sister and ask her how that weather is it in California?,sendemail
run reply to latest email received,sendemail
Send and email to mom to tell her Wyatt's birthday party is on Sunday,sendemail
reply back to emily,sendemail
PDA please write to this email,sendemail
Can you send an email to Chelsea please,sendemail
Compose email to my mom...,sendemail
send a replay email,sendemail
send that,sendemail
send email new address,sendemail
Send an email to the newest address added to the address book.,sendemail
send a remind email,sendemail
Send an email to mom.  What is the weather like there this week?,sendemail
Enter new address in email form.,sendemail
PDA: I want to reply to Bob Smith's email,sendemail
replay this mail.,sendemail
send a group mail to lookafter,sendemail
reply my address to john,sendemail
send this message to the family group starts with A .,sendemail
Send email to Rajesh,sendemail
Please send an email to my son regarding the payment of the fees,sendemail
answer the email,sendemail
Can you send an email for me to a new email address?,sendemail
send an email to mike about this weekend party,sendemail
send an email to my manager,sendemail
Could you please send back to Pawel this answer,sendemail
send john a mail for financial report 2017,sendemail
Send an email to peter that where he is now and if he is at the market text him to bring some wine.,sendemail
"Alexa, reply to the mail with the following content",sendemail
Look up contacts,sendemail
I have a new contact: newmail@gmail.com. Compose mail!,sendemail
"Please send an email to Uncle John with the following: Yes, I can make it.",sendemail
please reply to the email,sendemail
compose an email to _____,sendemail
send an email to a new address,sendemail
PDA: Reply back to Bob Smith...,sendemail
Please send an email to Sally regarding tomorrows meeting.,sendemail
Send an email to Bob,sendemail
"email David about the meeting tomorrow. David, can we have the meeting in the afternoon",sendemail
Will you send an email to this new email address?,sendemail
"mail administrator,",sendemail
Please send an email to (name),sendemail
Compose an email to (name),sendemail
Send email to Gary,sendemail
smsayyad1985@outlook.com,sendemail
"Alexa, send mom the following email",sendemail
email my sister about mom's birthday. Jane we should think about arranging the party at the park,sendemail
"PDA, create an email that needs to go out to my family.",sendemail
Create new email address.,sendemail
Read email and send to family member.,sendemail
I want to reply to Jean's e-mail.,sendemail
Send email to joe@aol.com,sendemail
send an e-mail,sendemail
Send email to,sendemail
Email co worker about work project,sendemail
write email to my company mate to submit the task tomorrow.,sendemail
Drop (sender) a line,sendemail
how we can get credit,sendemail
Reply to my email from Sasha saying thanks.,sendemail
send an email to 'rohit' saying 'I am busy tommorrow',sendemail
Send email to Bill asking to reschedule,sendemail
Email Robert.,sendemail
Reply to this email,sendemail
I need to send an email to Bob,sendemail
send a mail to whom to talk,sendemail
sent to,sendemail
Please send an e-mail to Larry's new e-mail at XXXX@gmail.com,sendemail
Email mom about lunch,sendemail
email john (body),sendemail
Send an email to all my co workers,sendemail
Forward email address to my new email,sendemail
Respond to Graham and let him know that I will be free tomorrow.,sendemail
send this emai to reply to the latest emails,sendemail
reply back to this email,sendemail
Send email to family member and read it first.,sendemail
send email to Naty,sendemail
send mail to some one,sendemail
Send an email to john asking him what time works for the meeting,sendemail
Send e-mail to Jim's work e-mail,sendemail
Send email to tim@hotmail.com,sendemail
I need this e-mail sent now,sendemail
"I did not want you to send that text yet, wait until I say send.",sendemail
reach by mail to my family.,sendemail
email tom,sendemail
email my mom,sendemail
"Send email to Emilia saying: I will be late, please don't wait with dinner.",sendemail
"PDA, Can you send the email to the new email id?",sendemail
"Olly, email Alice to let her know we are on the way,",sendemail
go to ne mail compile,sendemail
Email work team this week's schedule.,sendemail
Create an email for my co worker with my recently saved documents.,sendemail
"send email to Enalen, i'm going to send the files the next day.",sendemail
"reply to last email, say 'sorry cannot make it'",sendemail
"I need to write an email to a new address, brandon at example dot com",sendemail
All emails received between 10pm and 7am everyday is to be replied.,sendemail
Reply to the email from my bank and inform them that I have paid the credit card dues.,sendemail
Reply to Christy's email and say Thank you very much,sendemail
Quick reply to jack so please send a mail,sendemail
Email dad about fixing my car,sendemail
I want to email....,sendemail
dictate email,sendemail
"PDA, send an email to Stan Francis",sendemail
Send an email to Mom tell her I love you,sendemail
markpolomm@gmail.com,sendemail
sent email to,sendemail
Reply to this please,sendemail
Send an email to John that I am on my way to home.,sendemail
PDA send an email to Jesse.,sendemail
Email family with details of the party,sendemail
"PDA, send the email to this new email address",sendemail
find Naty from my contacts and send her an email,sendemail
Send an email to Joe that says I'm already here,sendemail
Reply to recent emails.,sendemail
I'd like to email Mary and ask if she wanted to meet up after work at TGI Friday's.,sendemail
reply to last received email,sendemail
Send an email to c@emoteck.co,sendemail
Reply email to Charlotte,sendemail
Start a new email to George Brown,sendemail
send a reply email 'thank you very much' to john@gmail.com,sendemail
Send this reply to received email,sendemail
sarasigmon123@gmail.com,sendemail
"Alexa, Send the mail to Robert about his availability on saturday",sendemail
"Email Grandma. Subject, Saturday. Message, we are dropping by on Saturday. See you then!",sendemail
write an email to my family saying I love you all,sendemail
through mail server,sendemail
Email to Caroline: How are you? Can you send me updates on last project. Cheers Tomasz,sendemail
reply email received,sendemail
Publish an email to my co worker with today's scheduled meeting information.,sendemail
hi send i love you message to my wife,sendemail
Send an email to Sharon.,sendemail
"PDA, send email to Cat that I will accept job offer",sendemail
can you please please reply for that mail,sendemail
Respond to my email from Bob letting them know i'll see them tomorrow.,sendemail
Send email to mom saying Happy birthday,sendemail
New email for contact,sendemail
can you reply to the email?,sendemail
Send email to new email address,sendemail
reply yes to this,sendemail
add this new email to my contacts,sendemail
send an email to dad how is the weather this week?,sendemail
Send an email to my sister,sendemail
"Please say to the email that sent me George, i need the money now. Its urgent",sendemail
Send an email to Bill that I'm sorry I didn't realize he was so sick,sendemail
Send an email to... that says....,sendemail
Send a sorry for your loss email to Pat.,sendemail
"You can send the email to abc@gmail.com, this is my new email address",sendemail
Please send the email to abc@gmail.com instaed of xyz@gmail.com,sendemail
send an email to fred from work he is in my contacts,sendemail
"Send an email to mom,  Subject, weather.  Body, what is the weather like there this week?",sendemail
Send an email to Sarah about brunch today.,sendemail
"Email Donna, plans for today?",sendemail
forward shown content to (  ) with email,sendemail
I want to send an email to... that says...,sendemail
Send Mom an email about the upcoming weather for the week.,sendemail
put a new mail,sendemail
send an email to my supervisor,sendemail
Answer with...,sendemail
Please send an email to John saying I'm on Leave,sendemail
email James about the softball game. James we need to get some refreshments before heading over.,sendemail
pass the following using email to,sendemail
Add a new email for Julie Smith.,sendemail
Respond to my bosses email with the word that I will be in at 4 in the evening.,sendemail
Open reply,sendemail
PDA: Add Bill's email to my address books and lets send him a message,sendemail
Email family,sendemail
please send a mail to Mr. richard  stating that i going to met him on 1/2/2017 at 5 pm at this office.,sendemail
Start new email for Yulia,sendemail
I need to send a reply to Charlotte,sendemail
"OLLY, SEND BOB AND EMAIL",sendemail
send mail to sil for cap,sendemail
send 'give the details asap' to john@gmail.com,sendemail
Can you open the reply box?,sendemail
Send help only to Jane,sendemail
Add new email to contact,sendemail
Send answer to George.,sendemail
respond to all that I am on my way,sendemail
Please send an email to the following email address <insert address here>,sendemail
Please reply to this email.,sendemail
hi buddy send mail to my friend hellen regarding home builders are not accepted the offer,sendemail
Send an email to jeff at gmail dot com,sendemail
Send email to boss to meet for performance review,sendemail
email joejoe@gmail.com,sendemail
send this content via email,sendemail
Just let me know next weeks weather in California,sendemail
send email to Chris tell him i will be late,sendemail
You should reply to the mail.,sendemail
make a new email for emily,sendemail
send a message to bill@mail.com,sendemail
respond to the mail of ash in morning,sendemail
reply to name,sendemail
"Hey PDA, Send email to...",sendemail
Send the email to John.,sendemail
PDA please respond to Greg's email stating that his idea is fantastic.,sendemail
"Alexa, create an email to mom and ask about this week's weather.",sendemail
I need an email sent to the following email address <insert address here> can you do that for me please?,sendemail
Can you reply to Charlotte that I am going to be busy with the projects for next three weeks?,sendemail
Write an email to Luke asking how the weather will be this coming week,sendemail
Send email to Yulia,sendemail
I want to send email to jack@gmail.com,sendemail
I WANT TO SEND AN EMAIL TO MY FAMILY DO YOU HELP ME?,sendemail
"Send to mom..hey mom, hope you have a great day today! See you [date : tomorrow.",sendemail
forward a mail to sandy,sendemail
Reply to Truette and let him know I will be there.,sendemail
email _____,sendemail
I want to reply to this email.,sendemail
send reply,sendemail
How many songs did Michael Jackson write?,factoid
Where is Montana.,factoid
about vijay,factoid
Where is denmark?,factoid
COULD YOU PLEASE GIVE ME THE BIRTHDAY OF MAHATMA GANDHIJI?,factoid
