What is the schedule of the next Maggie Rogers concert?,query
Is it currently snowing?,query
"PDA, has my calendar been update in the last 10 minutes?",query
What does my calendar look like for the next week?,query
list entry,query
did I get any replies from Jan?,query
"Hey Olly, what time does the next train depart?",query
Give me the details on (event),query
Show me today all train times of next 2 hours at Jodhpur to Jaisalmer.,query
Should I go to the market day after tomorrow?,query
which day is march 20,query
Do i have alarms set before  6 in the morning?,query
get news about new foreign policy,query
does restaurant has home delivery,query
Show grocery list,query
Can you please read the my Mom sent this morning at 10am,query
Do I have any appointments this weekend?,query
What are the details of this event...,query
Have any emails come in since 4:00 today?,query
When is it going to snow next?,query
How many emails do I have from work today?,query
what are my engagements?,query
give me a news paper,query
Do I need a raincoat day after?,query
When does the hockey Game start on Friday,query
tell me the time in Moscow,query
what is weather today?,query
What's been happening for the last two months?,query
answer emai lfrom,query
Is there takeaway at Donut Junction,query
How to I get to Cape Cod?,query
did Mike send me an email,query
What's the weather this week?,query
"Olly, what's going on between 3:30 and 4?",query
When is financial meeting scheduled?,query
sunday,query
Who's playing this?,query
PLEASE TAKEWAY OF GIVEING REQURIED OF THE RESTAURANT,query
give the time in Dubai,query
Do I have an Amazon list saved?,query
what will the weather be like on date?,query
"Hi, what kind of pictures you uploaded in Pinterest",query
"Will the temperature stay about the same, or is it going to get colder?",query
What do I have going on next week?,query
does dominos has a delivery option.,query
What alarm time had you set?,query
What's going on Facebook?,query
Do I have any new emails in my inbox today?,query
Are there any new Snapchats?,query
What are my newest emails?,query
What's coming up this week?,query
Please tell me the current date,query
Time,query
Tell me what the latest news is,query
What is the weather here,query
check my last post on facebook,query
What trips are available from NYC to Poughkeepsie?,query
Did Rosa ever reply to my email about the Global Warning Meeting?,query
Please give me a list of all of my lists.,query
Can I get delivery from dominos?,query
Tell me the top stories on the LA Times,query
how wet is going to be this morning?,query
Read me the content of this list,query
What is the time in Dubai ?,query
What time should I go for a hike?,query
What song do I play most?,query
Which day of week is the 24 th ?,query
Is my appointment to the dentist still on for tomorrow morning?,query
please read me my alarms,query
what is my meeting at 9AM?,query
WHAT TIME IS MY APPOINTMENT ON APRIL 4TH?,query
Please let me know the latest business news,query
are there any recent emails from {contact},query
where is tommorrows meeting shedulded,query
what are the events,query
by our scores,query
Do I have any new emails from Paul?,query
Are there any new snaps on Snapchat?,query
PDA tell me the current time.,query
Is it going to rain next week?,query
What list is available for my favorite music from Ed Sheeran,query
give me the list of available train tickets from A to B,query
What music is playing?,query
Latest New on international women's day,query
How long will it take to get to the airport,query
What is the temperature today,query
Get me match highlights,query
Check email sent by Contact,query
what is on my playlist?,query
When is Easter?,query
what is latest news about this world,query
list todo,query
Do I have any new emails from John Smith?,query
Should I break out my scarf and mitts for tonight?,query
please check my appointments,query
What time is it in Akron?,query
What is my schedule for [date : tomorrow] olly?,query
Top news,query
What are the top news headlines right now?,query
what is going for tommorow,query
Akhilesh Yadav get alignment with Rahul Gandhi for U. P. election.,query
Please check and tell me about the reminders i have placed today,query
describe your list,query
Read CNN headlines,query
how is the weather in utah right now,query
The 2nd of next month lands on what day?,query
How busy am I this week?,query
Has Mike sent me an email,query
Latest news from the area.,query
What did the clinic say about my exams,query
Show me the train schedules between madrid and barcelona for tomorrow,query
Tell me what's happening in European politics,query
the time the meeting start,query
What is on my shopping list today?,query
Has the University of Greenwich emailed me,query
What are the most recent developments on (specific topic)?,query
please give me my emails.,query
"Hi, What is happening in Twitter today.",query
open my reminders,query
what's the time in China right now?,query
"Hey Google, tell me what alarms are set for me.",query
Let me know what's accumulated in my inbox since 3pm.,query
Does 18 may contains any birthday,query
What time does the last train arrive in Dallas?,query
Plant-based news,query
What is the date of next Saturday?,query
Please give me all updates on the election.,query
What day of the week is 1st april?,query
Take me to emails from my boss.,query
What are the items on my list?,query
WHat is the latest news from CBS?,query
What time are we looking at right now?,query
Give me train times for tomorrow to Chicago.,query
Are there morning shows available?,query
"Ok Google, is it going to be a wet day [date : tomorrow]",query
weather report now,query
What's the current temperature?,query
Is there any pending reminder for me,query
Give me the newest New York Times.,query
PDA name: give me my latest email,query
What time does the train departs Lagos?,query
What did I tell Susan in my last email?,query
Can you tell me my appointments for this week?,query
Is it going to be windy tomorrow?,query
give me the latest updates,query
Where is the Acme meeting being held on Friday?,query
How long will it take me to go to the train station from here?,query
what is the weather forecast?,query
What topic is the most talked about today?,query
turn the news on,query
what's happening this weekend,query
list the lists i have,query
who am i meeting with later?,query
"Olly, do I have any calendar events this month?",query
"i just ordered food, call and see it has been delivered",query
Give me New York's current time,query
Read me the front page of the New York Times.,query
Where is the venue in which the marriage of Tom is going to takeplace,query
What do I need to complete first from the list Olly?,query
summarise week's weather details,query
alexa refresh my list and tell me whats on it,query
"During the timeframe of February 1 and March 16, what meetings occurred",query
Please read my facebook feed.,query
"yes , i have to know the weather is .",query
Can you tell me if I have any new emails?,query
Tell me if there are any events from three to five,query
"Olly, what's hot social media topics?",query
Tell me about the meetings over a period of time,query
get me to my friends list,query
Access latest news,query
What's the exact time we get food delivered once we place an order for food.,query
What is the weather in Los Angeles,query
Tell me today's date,query
Notify me when Trump is in the news,query
Is there an alarm for 10am?,query
What groups are listed in my contacts?,query
get me the news from XYZ news,query
Tell me about the alarm timings.,query
tell me about any new emails from my boss,query
Do I have new emails from John,query
What is the weather condition in NY?,query
what are the train times from San Francisco to New York,query
"Tell me what time it is in Dallas, Texas.",query
Look up whether or not Charley's Steakhouse delivers.,query
Open the local news app.,query
"Hey Olly, what time does the 4 train leave the station?",query
Will it be nice at the beach on friday?,query
Tell me if The Olive Garden allows takeway.,query
when is the event going to start?,query
My alarms,query
Are eggs on my shopping list?,query
"PDA, What is the latest news today",query
Show me weather list for tomorrow,query
Is the weekly weather supposed to be good this week?,query
Can you please update me on the latest tweets from my feed?,query
is the last order is ready,query
Olly what is the weather like outside,query
"Between May 1 and December 31, what meetings occurred",query
Will it rain in Toronto next Tuesday?,query
is it currently raining?,query
Temp Chennai,query
what lists are available?,query
Give the time of clasical music concert today in the city,query
Is there any email with [subject],query
"PDA, What is happening in the news?",query
What is up in my schedule today?,query
When is the next holiday?,query
what is the current pacific time,query
what is the latest news,query
"Do I have any appointments scheduled for March 24, 2017?",query
train schedule for today,query
Can you see if I have any new emails?,query
"Olly, tell me whats going on tomorrow",query
What day o the week is 14th,query
"Siri, how much is a train ticket",query
What's happening in the news?,query
did trey sand any messages?,query
Whats happening in football today?,query
can you locate some gospel music for me,query
What day does Halloween fall on this year?,query
Should I bring a umbrella with me this mornimg,query
What time is it in Cleveland?,query
At what time have you set alarm for me,query
Can you find out the latest world news from yesterday?,query
what's the latest news on CNN?,query
Will the highest temperature be more than 70 degrees tomorrow?,query
Do I need to bring a coat out tonight?,query
Please tell me the main points of my 2:00 meeting from this afternoon.,query
"PDA, whats it like outside?",query
Do I have any appointments on March 30th,query
My weekly plan,query
Show me the train schedules to the Metropolitan Opera House.,query
Who should I expect to be at the meeting today?,query
What artist is this?,query
Show me where I can find a train,query
what are the estimated temperatures this afternoon,query
Will I need a Jacket [date : tomorrow] evening,query
What day of the week is it?,query
is it gonna snow,query
Is there anything new on Snapchat?,query
What is my list?,query
What has shown up in the news recently?,query
"Directions to Virginia Beach, VA",query
will arby's offer takeaway,query
"Can you tell me the current time in Dallas, Texas?",query
Tell me what is on my calendar for [date : tomorrow]?,query
Latest news updations,query
how many hours gone from midnight on  city.,query
Olly please check if i got any emails from mom,query
let me know if there are any new emails from Callum,query
What's the current time in New York?,query
What time do I have appointments today?,query
can you tell me what time is it,query
Show me rediff masala,query
What is the song name,query
Will I need sunblock this weekend?,query
my health planning,query
please open the news app,query
please let me know about topic X,query
information of recent events,query
the news from cbs alexa,query
What music do I prefer?,query
can u give the date today,query
"Hey Google, what time does the TRE train go to Fort Worth this afternoon?",query
list emails from jim for today,query
Please tell me what the world news headlines are.,query
what's the time in madrid,query
where is my meeting at 9AM?,query
What's the weather forecast this week?,query
What thing is in the list ?,query
check gmail for last hour,query
when and where Monet's exhibition takes place?,query
can you tell me the time right now?,query
Did i get an email from FedEx?,query
where the party will take start,query
do i need umbrella now,query
When does my alarm go off?,query
Does Monday's meeting at 8am include Chuck Ingerman?,query
Lists,query
check if there any new email.,query
Please show new emails,query
Today is Holiday?,query
Look up for my email updates.,query
Let me know the latest weather news,query
how warm today is,query
What is the schedule for [date : tomorrow]?,query
this weeks events,query
what is the weather report,query
Should I wear a jacket?,query
What is the weather like in Iowa.,query
At what time does the next train leave for Berlin?,query
Who is doing FaceBook live right now?,query
What are my next 3 events?,query
Am I off work on Memorial Day?,query
I need to seem my lists.,query
"PDA, What alarms do you have set?",query
"PDA, Are there any alarms set?",query
Help to remind me to delete completed projects,query
Do I have anything planned today,query
What do I have planned next Monday from noon to 3:00,query
Did X replied to me on mail ?,query
weather Fulton Missouri,query
What time is my reservation for this Saturday?,query
Time in New York,query
Is it windy today?,query
Google is my Thursday appointment with my dentist?,query
Are there any new emails from today?,query
What day of the week does the 15th of March fall on?,query
whats the time?,query
please check weather on tuesday,query
What is the chance of thunderstorms today in Biloxi,query
"Can you get me train ticket prices, please?",query
which film the music comes from?what is the name of the music,query
"Cortana, open MSNBC news.",query
Checkout today third set alarm.,query
PDA! Ask my friend hows the climate there.,query
give me all my recent emails,query
"What time is it in Tokyo, Japan?",query
Does Peking Garden do orders online?,query
Tell me about the latest environmental news.,query
Are there any emails I haven't read yet?,query
"On the list, tell me the names.",query
Hows it going to be today,query
"What is the current temperature in Austin, TX?",query
What is the news from that newsource?,query
check on the delivery of my current order,query
How much time is a train to there,query
Will the weather be bad on Sunday?,query
could you tell me the time in london,query
"Pda, What time is my xxx Meeting at?",query
show me the highest weather this week,query
Tell me if I have new emails.,query
Is it going to rain today in Columbus?,query
notify me about news,query
Is today going to be sunny?,query
how is brexit going recently?,query
What was the news for March 4th 2017?,query
Find me new comments from my Facebook,query
Can you brief about the next scheduled events?,query
What is the weather like in Brooklyn right now?,query
sound cloud,query
"How long will it take to get to Austin, TX?",query
when is the next appointment on my calendar,query
is there any alarm after 5 am,query
Alarm Status,query
its hot today?,query
"Olly, do I have any new email from Ryan?",query
Is this event date right?,query
Give me election updates.,query
What is the forecast in my area today,query
train schedule,query
which time train dep,query
PDA check emails from someone,query
any event message is available in last two days,query
Read my unread emails,query
"PDA, What's the directions to the nearest pizza hut?",query
get the forecast of my destination city next week,query
Who is scheduled for tomorrow's meeting?,query
mention the thing in the list,query
I need to know all new news on the Houston Texans draft.,query
what are the top headlines around the world,query
"New news, tech",query
Give me the latest political headlines across the world.,query
How do i go to Athens by train?,query
What is the latest news for fashion.,query
Do I have any emails from hongbin.,query
Do I have a meeting on Saturday March 25th?,query
Should we expect rain this afternoon?,query
"Siri, what time is it in Denver?",query
What is going on with blank?,query
"Hey, when is the next local from Mumbai to Pune?",query
"PDA, do I have messages in my inbox?",query
What time do I have down for Susan's Party?,query
"PDA, I'd like a train ticket to this location.",query
Please check for new unread emails from Paul,query
Tell me this song,query
is it raining in Barcelona,query
What events are scheduled this week?,query
Do I need a coat?,query
Repeat the last message,query
do I have anything scheduled in my events,query
follow the following news topic,query
weather for remchi city,query
check outlook,query
Tell me about the schedule.,query
what are the events next week,query
Has Mary responded to me email yet?,query
what day is the 15th,query
show emails about contract,query
can i get takeaway from Arby's,query
Tell me what lists I have.,query
Give me updates on the situation in France,query
Will it rain today?,query
Checkout today alarm of meeting.,query
please show me lists,query
temperature this hour,query
give the shortest route to the airport,query
What is the time difference between here and <insert city>,query
When can I expect my Chinese takeout from Fortune Garden?,query
How soon can we expect rain?,query
give me updates on this news,query
tell me if the following is true about the weather:,query
give me the details of next reminder,query
Show me whats happening,query
would like to know the alarm you sent,query
Tell me about the most recent road construction on route 70?,query
What else is on my calendar after my last meeting at 2 PM?,query
Did I get any emails from Sam today?,query
what time is it right now in new york,query
whats the day today,query
ems pda,query
check my calendar for today,query
Any new emails?,query
Do I have any undone tasks?,query
schedule,query
Show the list that are available with numbers,query
how to go the nearest mall asap?,query
What is included in the tour's list?,query
Do I have any new email from John?,query
what does source have to say about topic,query
Should I wear a short sleeve?,query
What is today's weather?,query
what does my schedule look like today,query
What is the current weather in New York city,query
Check email for OTP sent by my bank.,query
Is today a sunscreen day?,query
do I have any alarms set for 6 am tomorrow?,query
list new emails,query
whats the time in london,query
Is there any chances of rain this week.,query
on Tuesday what is the weather supposed to be,query
What is my first appointment today?,query
"olly, list most rated deliveroo options for chinese food",query
latest updates,query
Is there valet service at the event,query
Recommend artists similar to Rihanna,query
tell me news from canada,query
What time is it in the Central timezone?,query
Tell me more about the scheduled events,query
What time is my alarm set for?,query
Let me know if there are any new emails from eBay,query
what alarms are currently set,query
Delivery from dominos.,query
Am I going to get wet if I go outside this morning?,query
Give me the headlines from Sky News,query
Who sings the song about a long black train?,query
Who sent this email ?,query
Just let me know next weeks weather in California,query
Is there any chance of rains in Mysore to beat the heat,query
Could you please tell me what the current time is?,query
"How many people were at the protest in Times Square, yesterday at Noon?",query
is weather normal today?,query
Do I have any notifications,query
how soon is my anniversary,query
Have I got any new emails,query
What is on my to-do list today?,query
What year was this song recorded?`,query
Am I on vacation this week?,query
Do i need to carry an umbrella tomorrow,query
Is it the 29th already?,query
Are there any alarms currently set.,query
"Events, description",query
Who is singing?,query
What are the top world news stories?,query
what are meeting scheduled for today,query
How many unread emails do I have?,query
Give me lists,query
Tell me about the latest sports news,query
How is the current weather in Washington DC.,query
Ask for the weather today evening,query
Is there any email from Emilia?,query
do i have any new emails from my contact Q?,query
More information on this event...,query
check email,query
Do I need to take a hat me me ?,query
When is the next time it will rain?,query
what is the high for today?,query
What is happening in the election,query
Are there any news on the weather?,query
Show me emails from my friends.,query
"Olly, tell me the temperature.",query
Does paradise has takeaway,query
What day of the week is Sept 12 of this year?,query
Am I scheduled to meet Fred in my calendar?,query
Has anything new happened with _____?,query
Does dominos deliver?,query
Is there anything important happening on social media,query
please tell me what is the time in tokyo japan.?,query
Olly what happened lately regarding fashion?,query
Can I check my lists?,query
Do I have any unread emails from Chris Thompson?,query
Check my email for any new email from Joe.,query
Do I have any new email?,query
Is calendar event false?,query
Take me to T.Nagar,query
what lists do i have saved?,query
What's on the radio right now?,query
What time is it in Beijing,query
When will it start snowing?,query
What is the weather?,query
"Alexa, give me another update on breaking news.",query
Have I received any work emails from Jeff?,query
What is happening in the world today?,query
how the cold today,query
Tell me the current weather for Danville IL,query
find list in my pda,query
Search for new email after 5pm,query
Have I gotten any new emails?,query
get me the latest news in new delhi,query
What are my reminders for this week?,query
Let me know when Casey emails me.,query
Do I have any private messages on any social media?,query
"Olly, should I wear my gloves or not?",query
Did I get an email from Sarah?,query
"Olly, anything else left on the list?",query
How to get to Cracow before noon by train,query
What time is it on the west coast?,query
PDA when is Dale's birthday?,query
What music service has some soul music I can listen to?,query
most viewed list,query
What is the latest update on <insert topic here>,query
show the list,query
Where is Mary's birthday party being held?,query
at 4pm how long will be the remaining travel time to the destination,query
I need to know the time?,query
Do I have any new emails?,query
How's the restaurant's delivery going?,query
can you tell me the current time?,query
what do I have planned for today,query
What news updates are there from news express,query
How safe is the city regarding law and order.,query
Tell me present time in Malaysia,query
What time is the earliest train to Glasgow?,query
What events do I have coming up in my calendar?,query
I want to know about [news topic],query
tell me who the senders of my emails.,query
What is the current price of brent crude?,query
Read me the last email from Stefan and oil change,query
Status for the pizza delivery from Pizza Hut,query
how is the weather in this week,query
learn coding,query
will i need to bring rain boots after lunch?,query
Set notification for 6 o clock news update,query
Next train to Orlando,query
What is the latest international news?,query
Is the weekend going to be nice?,query
Air pollution,query
Hot news.,query
how do I get to starbucks,query
PDA: What did I put down already on the Walmart list?,query
Do I have any new emails from Dan?,query
update on April the giraffe,query
how long does it take to get from here to chicago by train?,query
List events from this three o'clock to five o'clock,query
What is the extended forecast,query
What news came out about Steve Bannon?,query
Check most current emails,query
Do I have any new email from Joe?,query
Most recently received emails,query
Next train to D.C.,query
"PDA, how is the news media reacting to Trump's potential ties with Russia?",query
"Take out available, Louies",query
fix the driving route from here to grant market,query
what is the time in London now,query
Do you know if there is any rain today,query
What song is that?,query
Do I have anything scheduled for today?,query
Please let me know when Delia replies to my email from this morning.,query
where are the boston redsox playing next,query
What's up with my order?,query
Would you go check my emails for me?,query
is summer going on?,query
Is my golf game going to get rained out?,query
where is the venue?,query
What's new on iTunes?,query
what are the train schedules to New York,query
What times are my alarms set for,query
What was the date two Wednesdays back from today?,query
Will Sting be in Tampa Florida soon,query
What do I have planned for Friday?,query
What is happening in the world news?,query
Is it a soft evening tonight?,query
Is there Christmas on 22nd.,query
Is it currently raining in New York City,query
check for new email,query
Get news from FOX,query
How cold will it get each night this week?,query
What lists do I have queried?,query
do i have any remainder about birthday party,query
Is it going to be cloudy or sunny today in Bangalore,query
whats the next train at westcombe park.,query
"What is the weather like in New Brighton, PA?",query
"PDA, what time does the festival officially start?",query
what is on event calendar for today,query
Is there going to be fog in the morning?,query
Olly you need to find an alternate route to my destination,query
get a forecast about wind speed tonight,query
Have any emails arrived in the last 15 minutes?,query
PDA is my alarm set for tomorrow morning?,query
does cnn have any breaking news,query
"what is the weather ( if i want to know the local weather, I will not mention the city)",query
What events are going on next week?,query
what's the date?,query
What time is it in the eastern half of the US right now.,query
what is the subject of the last email sent to me by Q?,query
Tell me what day of the week it is.,query
Do I need to do anything today?,query
Should I bring a jacket with me tonight?,query
do i have a game on april 7,query
let me know about election new.,query
check new email,query
Give me tomorrow's weather update,query
news of the train wreck,query
Check mail with [subject],query
"Pawel, prepare the meeting with XXX",query
"PDA, What's the time in this timezone?",query
Have I set any alarms in the morning?,query
road speed manoeuvres,query
Is the weather cloudy tonight ?,query
Tell me the weather in Shanghai,query
