I need a recipe for chicken thighs for my pressure cooker.,query
what's the weather like on friday?,query
open my reminders,query
give me the news update from BBC,query
get contact,query
when the meeting start,query
How is it outside?,query
What list do I have,query
Search for new stuff on that subject,query
let me know about the news of india-pakistan match.,query
show the list,query
Review the alarms I have,query
Tell me today's weather report of city A.,query
Do you think it will be okay to wear shorts this week?,query
Please tell me the latest news,query
What's the time of day right now?,query
When does the next train to work leave,query
Do I need to wear a coat?,query
Go fetch all the lists from the notes app.,query
How to get to Cracow before noon by train,query
can I wear sandals,query
Will I need an umbrella for today?,query
list all the meetings scheduled for today before 6 pm,query
"What's the latest news from CNN, please",query
what on my play list,query
How many alarms do I have set for morning hours between 6 and 9 am,query
What day does april 16th fall on?,query
Olly has Robert emailed me yet?,query
Ten day forecast for Baltimore,query
"PDA, whats my schedule today",query
"Olly, find out if KFC delivers, please.",query
driving time to Los Angeles,query
When is the next train leaving for Austin,query
"Do I have any alarms set, Olly?",query
Get me fresh news.,query
What trips are available from NYC to Poughkeepsie?,query
what time is it in des moines?,query
upcoming events,query
what's time,query
"Cortana, find the latest article from Chris Hedges on Truthdig.",query
What are my plans for the month of May?,query
where is the kiss concert?,query
the weather forecast,query
popular culture news,query
Please tell me the news.,query
Check if I have set any alarm for morning,query
what are my engagements?,query
whats the day today,query
News articles on a particular subject,query
Can you tell me when my appointment is supposed to occur?,query
Today is 5th Mar?,query
"Olly, which new emails were recieved ?",query
tlemcen weather,query
Will it be windy tonight?,query
What is the song name,query
Any new emails from Derek?,query
Do I have anything scheduled for March 7th?,query
Is there going to be fog in the morning?,query
Do i need  a jacket in the evening,query
Read what lists I have,query
Tell me what day of the week it is.,query
What time is Bina going live with her sale on Facebook?,query
What is happening on Facebook?,query
Describe event on March 19th at 2 PM please,query
is it suppose to rain today,query
Give me the time in PST,query
"i just ordered food, call and see it has been delivered",query
What meetings do I have between 8-10 today?,query
What will the weather be for the next week?,query
What is the title of this song?,query
Am I busy today?,query
Do I have the reply from Charlotte relating to yesterdays enquiry?,query
what is the weather like right now?,query
What are the details of this event...,query
is there any alarm after 5 am,query
hey siri what time is it,query
What lists are currently available right now?,query
"hey Olly, is it going to rain today in Brooklyn, New York?",query
Whats the latest news?,query
what is the weather this friday,query
What do my lists look like?,query
run recent email,query
My list please.,query
How hot is it currently in Costa Mesa ?,query
Hi do I have any new emails,query
What's on my list to do today?,query
PDA is Mr Pizza on skip the dishes?,query
"Olly, weather conditions for the next day",query
What events do I have for this coming week?,query
Forcast,query
[list name items,query
How many items are on my to do list?,query
"Echo, have I received any emails from my father?",query
What time is it in pacific time,query
What's coming up this week?,query
Tell me my options for a train to LA next Wednesday or Thursday.,query
Will it be rainy day tommorrow?,query
how free am I this week?,query
I need to know what is the date today.,query
normal tempareture,query
tell me about trump!,query
"Please find a email from my friend, Tiffany",query
Is it raining later today?,query
Today is what day?,query
search email for contact,query
What do I have today?,query
do you serve for home delivery?,query
What date is the third Friday of this month?,query
Please check my E-mails and notify me if exists any new E-mail.,query
give me the latest updates,query
What's the latest on Trump's travel ban?,query
Have i need to take a sun glass ?,query
Current time in,query
Which grocery stores have I mad a list with?,query
Plaease give me detail of o zaalima song.,query
when is my train coming,query
Am I scheduled to do anything on x day?,query
Was this song in the top 20?,query
Show me where I can find a train,query
Keep me updated on this,query
ems pda,query
any recent emails from Anna?,query
when are holiday in current month,query
Tell me upcoming event's,query
Who is the songwriter?,query
what new messages do i have,query
What events do I have remaining today?,query
Anything new PDA?,query
Give me the time in London,query
can i have timing of keral express,query
what time is it in New york,query
find nearest train station,query
What time am I supposed to pick up John again?,query
Cricket/live scorecards,query
Is it snowing right now?,query
Will I require umbrella [date : tomorrow] morning?,query
What is the entrapreneur saying about homelessness in the Seattle Times article,query
watch out my new mails on inbox,query
Is it going to rain on Monday?,query
What is the phone number for the nearest location of Church's Chicken.,query
Is there any train plying from Pune to Mumbai tonight?,query
What time is the train to San francisco due?,query
Will it rain on the 22nd?,query
Find train tickets for <train station> for <date>,query
Tell me the time in another city in US,query
"Give me the time in Phoenix, AZ",query
What are all my lists?,query
Show me the list of alarms,query
ios,query
what is on my schedule for 9 to 11am tomorrow?,query
What time is it now in New York?,query
Show me recently added events,query
Do I have any new email from Joe?,query
Check for emails from my employer,query
what is the time now in new york,query
Find out if Eddie Richards has sent an email about the budget requests.,query
What's the weather like today?,query
Show me my husbands Facebook posts today.,query
Do I need to wear my slicker today?,query
"display recent email from John, Olly",query
manoeuvres,query
Read me my alarms,query
Tell me the current time in San Paulo Brazil?,query
Did I get any messages from John?,query
Google find the new email address for Bill that I added Friday.,query
PDA please check my coming up events,query
What are the latest world news?,query
Tell me what's happening in European politics,query
Will you please show me my lists?,query
Please tell me the date,query
DIRECTIONS TO DISNEY LAND,query
what's the forecast for this week,query
can you find me a train ticket to go to las vegas,query
List the 20 most-repeated songs,query
What is tomorrows weather predicitons?,query
Please show me the local weather,query
what are my engagements today?,query
can you give me local news on wayne county sheriffs?,query
Check emails for last 2 hours,query
What is the time in Chicago?,query
"What day of the week was February 4, 1972?",query
What time do I have appointments today?,query
Could you find a train back home at around 7 pm?,query
Do you recommend an umbrellas?,query
can you read me news on Trump?,query
can you tell me what month it is,query
What date is it today,query
I would like to tell my personal digital assistant is  provide me to more information storing,query
what is the train schedule to denver?,query
emails from jane doe,query
what is the fastest way to get to starbucks,query
is it raining?,query
give me updates on this news,query
"Siri, schedule a news update for [date : tomorrow] morning at 7:00 a.m.",query
check the weather app to see if,query
I need a train ticket to denver,query
What are the subject line and sender from today's email inbox?,query
What is the time in Ajmer ?,query
Please find out of Charley's Steakhouse delivers.,query
Help to remind me to delete completed projects,query
"PDA, do I have any emails from John in the last week?",query
Show me emails from my friends.,query
What meetings are on my calendar today?,query
What is scheduled for today?,query
what is going on in politics,query
What is the weekly weather report?,query
I want the complete weather details of 7th March,query
Fast me the news of academy awards,query
What's the news in politics on CNN?,query
What is the weather like this week,query
When is the next SEPTA train to Philadelphia?,query
Will I need to wear a jacket next Wednesday?,query
Olly what do I need to get done today?,query
What is today's date?,query
whats the weather like tomorrow.,query
What do I need to remember?,query
At what time is my alarm set?,query
What day of the week is 16th,query
Remind me the reminders I have set,query
Search new mail,query
Read my todo list?,query
I would like to know the route the train will go to get to Miami,query
are there still tickets to the kiss concert?,query
What do I need to complete first from the list Olly?,query
What type of weather can I expect today?,query
What are the items on my list?,query
Am I scheduled to have any meeting today,query
olly whats this playing right now,query
How's the restaurant's delivery going?,query
Read me the last email from Stefan and oil change,query
do i have an alarm set for today,query
Is Mothers Day on a Sunday?,query
Is there any new information regarding the Mexican-American border wall?,query
Who is singing this?,query
"I haven't checked my Facebook yet, are there any updates from my close friends?",query
Hey what is the weather like today,query
Please let me know what's happening to my social media?,query
Whats the news on bbc news,query
road speed manoeuvres,query
what alarms are set,query
Will the weather be less than 10 degree in (Specific City) ?,query
I am gonna need an umbrella today after sunset?,query
How is weather in New York City?,query
Does this restaurant only do carryout?,query
Did Erin send me any emails?,query
Olly what happened lately regarding fashion?,query
Please show me today's date?,query
Update me about [news topic],query
Up coming events,query
What is the time Central,query
PDA tell me the current time in Ottawa.,query
show weather,query
could you please recommend a Mexican restaurant for take out?,query
Anything new on social media?,query
Let me see my most recent emails,query
Please find today's forecast,query
Let me know about any alarms set today.,query
Will there be a fall in temperature by tonight,query
can i go outing without any umbrella/raincoat,query
what time does the train arrive?,query
When will my meeting with Sandy occur?,query
Notify me about any updates on vaccine laws,query
Tell my meetings for tomorrow morning.,query
was christmas 1972 on a weekend?,query
what is on my playlist?,query
Please give me a list of all of my lists.,query
When will the match start,query
what will be the condition of weather next seven days,query
Please find information about the Zach Brown concert on June third.,query
What time are my alarms set for?,query
title?,query
What alarms do I got PDA?,query
How to I get to Cape Cod?,query
What is on my calendar today?,query
Is it going to rain later today?,query
What alarms are set for this week Echo.,query
Can  i go out in shorts,query
which date is on next monday,query
What's the weather like in Sydney?,query
Will I need sunscreen this afternoon?,query
Do I have any appointments today?,query
What is on my rap playlist?,query
Should I pick up some defrosting salt at the store?,query
When is my meeting with Human Resources?,query
"Cortana, identify current song playing.",query
Read my most recent emails,query
read my next reminders for this afternoon,query
Tell me about the meetings over a period of time,query
Make sure I have nothing to do on Friday.,query
Hotel California is sung by whom?,query
Is there anything on my calendar,query
alexa refresh my list and tell me whats on it,query
What is on my list today?,query
any sport event is on my list.,query
Notify me when there's news on the Dakota pipeline,query
when is the next appointment on my calendar,query
Will there be any snow next week?,query
How long until my order arrives,query
May I know what is trending in twitter?,query
Do I have class on Monday?,query
"PDA, can you read me my Lists?",query
Who is currently leading in the parliamentary election?,query
What are the latest crime statistics for my area,query
Do I have any appointments this weekend?,query
Should I put on a jacket when I go outside today?,query
Have I received any emails with tracking numbers?,query
train schedule to..,query
"Olly, find my food.",query
i need the details about my next schedule,query
Can you please tell me the current weather condition,query
What is London Time?,query
Any news updates from BBC?,query
today how many alarms do i have set,query
please show me lists,query
What appointments or meetings do I have coming up for this week.,query
hey olly. do i have any emails from Bob about the bulldog?,query
What are the names of all my saved lists,query
Is the new Stephen King book on my list?,query
Does the nearby dominos have delivery,query
whats the news about in africa,query
What are the headlines from the new york times,query
fix the driving route from here to grant market,query
What is the outcome of blank today?,query
what time is it right now in new york,query
What is on the agenda for the 4PM meeting with Joe?,query
describe your list,query
What is the weather in Sydney now?,query
On what date is Easter this year,query
do i have an email from person A.,query
Open Emails,query
What are my meetings for this week?,query
check the weather of city A.,query
what is the headline from Chicago Tribune?,query
Find me the current weather condition.,query
show pending reminders,query
Map out a route from here to Abita Brew Pub,query
What are my tasks?,query
What is the weather forecast for Chicago?,query
Notify me with news updates on Nigeria,query
Please tell me the date and time?,query
"Directions to Virginia Beach, VA",query
list next month's events,query
What lists are in my notebook?,query
get today's weather report,query
How will be the weather today in the afternoon,query
whens the next train to cornwall.,query
Have I got any alarms set?,query
What's going on in politics today?,query
Tell me the time now.,query
Let me know if anything happens on that subject,query
Do i need a jacket this afternoon,query
let me know what is remaining on my query,query
What time is next meeting,query
Should I carry an umbrella with me today?,query
What is my grocery list?,query
What time does the Zach Brown concert on June 3rd begin?,query
do i have any reminders today,query
What day o the week is 12th,query
Do I have email from my work?,query
Which is the song playing now?,query
Give me lists,query
How many birthday's are on 23rd.,query
Tell me the takeaway food around this place,query
show time in mumbai,query
What's new on textile design?,query
show bbc news live,query
What are all the upcoming events,query
How many emails have I received recently?,query
"Olly, check my email.",query
what is the weather right now,query
What does my facebook feed look like?,query
can you locate some gospel music for me,query
Check if I have mail from John?,query
PDA please check recent emails from new contact,query
How will be the weather today in the evening,query
Did I leave myself any reminders?,query
How soon can we expect rain?,query
Is it 5:00 yet?,query
"Read me the email from Mom, including the subject.",query
What is the the Times headline?,query
Please tell me what is the time in sanfranscio.,query
What's on my calendar this month?,query
What day is payday?,query
Do you know if there is any rain today,query
Will there any events downtown this weekend?,query
Can you read the names of my lists of reminders?,query
Today's news CNN,query
Do i need to take the umbrella out today?,query
Should I bring an umbrella today?,query
Has the war in Syria ended?,query
Show me the time now in Boston,query
PDA please check my email for me.,query
Show me a forecast,query
Check my last post on Instagram,query
Can i dry my clothes on the line?,query
Check with news to see anything new on Trump.,query
What is the latest poll on the public view of President Trump?,query
Please inform me of any new status updates?,query
how is the news in ireland?,query
What's the humidity level?,query
How much Indianapolis Express will take to reach texas.,query
I want to know the weather in Nashik.,query
give me the schedule for today's events,query
show latest reports of bbc,query
Please give me update of Hockey,query
Finances.,query
Tell me my list,query
I'd like to know what time it is right now.,query
Are there any trains leaving from New York City at 8pm?,query
do I have any reminders on my list?,query
Tell me what lists I have.,query
Who's playing this?,query
"Olly, I have a doctor's appointment at 2pm today.",query
Is it raining tonight?,query
what's the time in madrid,query
Who is this?,query
Open train routes,query
Will I need to carry around a brolly today?,query
Where is the nearest train to me?,query
Get me the time in London now.,query
Check instagram.,query
What is the time in Hyderabad ?,query
Is Fox News reporting any breaking news at this time?,query
PDA do I have any tasks today?,query
can you tell me what alarms i have set,query
Tell me what was the temperature in our city at 12 pm.,query
does restaurant has home delivery,query
Can I see my Facebook feed?,query
What is the latest news from Syria?,query
Is there any email from my contacts,query
how many new emails do i have,query
Any recent news about North Korea?,query
show bbc news of migration,query
where is my 12pm meeting today happening?,query
tell me today's sports news headlines,query
What's new in news express,query
Olly you need to find an alternate route to my destination,query
How long does tonight's dinner party last?,query
What list is available for my favorite music from Ed Sheeran,query
can it takeaway from ammi biryani.,query
What does the clock say?,query
Keep mu up to date on the election news.,query
Olly I need to know if I have any new reminders?,query
Show me the train schedules between madrid and barcelona for tomorrow,query
What will the weather be next week?,query
Lists,query
Tell me the weather.,query
Give me the news on my provider.,query
How is weather likely to be in my area today?,query
Tell me about all my events.,query
"Please, check for new emails",query
Do I have any meeting tomorrow morning,query
Please let me know the morning alarm time kept for Weekends,query
"Olly, are there are new email from Mary?",query
Is it noon in Paris?,query
Read to me the email of John Smith.,query
Can I get a train ticket to Chicago for next Saturday around noon?,query
What are the latest tweets from the new york times,query
Will it rain on August 15th?,query
"PDA, does that restaurant allow call-in orders?",query
What is the current time in Delhi?,query
Please show today meting with clients,query
Is the 10K on the calendar for July 2?,query
Is Mary's birthday party tonight?,query
"If I go outside, will I need a hat and gloves?",query
Tell me my congressional representatives voting records on reproductive health issues.,query
Please keep tabs on how the presidential debates are going.,query
do i have a meeting on friday,query
Olly can I use brown sugar instead of white in peanut butter cookies?,query
What was the date two Wednesdays back from today?,query
"Calendar up, when is my financial meeting on Friday?",query
read mail,query
is it going to snow this week PDA?,query
Should i wear my sunscreen,query
Show the list that are available with numbers,query
Did I make a shopping list?,query
will it be hot?,query
Send me current news for the day,query
What do I have on my schedule for tomorrow morning?,query
What will the weather be like in Oklahoma City on Monday,query
What's the weather like tomorrow?,query
Send wedding invites to all wedding party.,query
find my thai takeaways around grassmarket,query
Announce the current time,query
Does Pizza Hut have my order ready?,query
what is the skedule on,query
get route for LA from here,query
DId I put toothpaste on my pick up list?,query
Time in Chicago,query
what lists do i have saved?,query
Please check for recent emailstudy from this sender.,query
Is there anything new in my gmail?,query
Are there any alarms going off today?,query
Please tell me what time is now in canada,query
do I need to take an umbrella with me this afternoon?,query
"Tap Start, and then select Settings.",query
what is the forecast?,query
Should I go to the market day after tomorrow?,query
Is there anything new on Snapchat?,query
when I should leave to XXX,query
Can you pull up the current news stories?,query
will it snow this month ?,query
When did pop it like it's hot come out?,query
Do I have any meetings scheduled the weekend after next?,query
read email from julia,query
Check emails from cindy,query
Can I wear shorts out while shopping today?,query
"PDA, whats it like outside?",query
what is the news about terrorist attack in afghanistan.,query
on politics,query
"Olly, new email from brenda?",query
Inform me about the latest news of Donald Trump.,query
what is the dress code for tonight,query
weather this week,query
What are my next few events?,query
what time is the alarm set for tomorrow?,query
What is happening in the world today?,query
I would like to hear my lists.,query
Repeat my reminders from  yesterday?,query
Will I need a Jacket [date : tomorrow] evening,query
Give directions to Pizza hut.,query
Get me the details of upcoming Oscar 2017.,query
What is the weather?,query
What is the latest news about the Mexico-America border wall?,query
Is it going to freeze overnight?,query
Show me my latest social media activity.,query
will i need to wear a coat today in the afternoon?,query
Please tell me when's my financial meeting?,query
Who has written to me or mentioned me in social media?,query
What is the weather in Seattle now?,query
nearest way to return home,query
What song is playing now.,query
Can you pull up information on the singer(s) of this song?,query
read freds emails,query
How cold is it outside today,query
What are the scores fo the two UCL games going on right now.,query
Is there anything new happening in politics today?,query
when is the train arriving today?,query
what time is it in someplace?,query
Where is my list,query
What's on for the 14th afternoon that I could go with the two year old twins?,query
Is anyone likes my latest photo?,query
find news about Brexit,query
Are there any new emails received after 4 o'clock today?,query
how warm is it right now outside?,query
Please tell me the weather.,query
Do i need a jacket,query
is tomorrow going to rain?,query
When do I have that test?,query
Do I have any appointments tomorrow?,query
List alll set alarms.,query
is it night time in Peru,query
Is it supposed to rain tomorrow?,query
Facebook Launches 'Disputed' Tag To Crack Down On Fake News,query
Did Bert write me today?,query
Show me my last 2 emails,query
is dinner ready yet?,query
what are my meetings in the coming week,query
what is the current date in india,query
what lists must i remember,query
Show alarms,query
"During the timeframe of February 1 and March 16, what meetings occurred",query
Give me the names of my lists.,query
I want the news about academy award,query
Can I wear my sandals today?,query
Whats the weather report for Bangalore today,query
Where is my food,query
It seems cold.,query
any event message is available in last two days,query
Can you tell me what the time is right now?,query
What is the location of my work project meeting?,query
Which day is march 24th?,query
Have I gotten any new emails?,query
have I received any mail in the last hour,query
Find information on today's stocks,query
Arrange the list in alphabetical order that are available,query
What is going on right now on twitter?,query
who are the last number of people I got emails from?,query
have i set any alarm for today.,query
Tell me about the vote on healthcare,query
show last mail from john,query
Just let me know tomorrows weather,query
what are my appointments today,query
Did I remember to set a reminder alarm for my next doctor's appointment,query
I need directions to Meijer Gardens,query
Do I need sunscreen?,query
Who should I expect to be at the meeting today?,query
How much for a train ticket?,query
What are the train times to travel from NYC to Poughkeepsie?,query
currency converter,query
PDA! Please read my new mails,query
is there a train ticket available for boston tomorrow?,query
do I need umbrella today?,query
"What day does my birthday fall on this year, June 27th?",query
Does the restaurant have delivery?,query
did ben's email have an attaachment,query
Latest finance news,query
PDA I need to know if Mr Pizza delivers.,query
PDA name: how much long until xxxx arives at xxxxx station,query
list out  my schedule today.,query
did trey sand any messages?,query
Do I have any alarms set for tomorrow?,query
Please see if Chili's has delivery.,query
can you check for any new emails?,query
Search for the latest news about Iphone,query
Let me know about my meetings after some days,query
how do i get to old street?,query
am i going to need to put on sunscreen lotion today?,query
is it going to be cloudy in London during the weekend?,query
List my different alarm,query
Is calendar event true?,query
I AM NEED MY HAP TODAY,query
what is the weather near me this week,query
Any new email from the boss?,query
Check my new emails,query
Tell me what is in your list.,query
are there any emails unread by this person,query
What is the current temperature in Miami,query
Checkout today alarm of meeting.,query
