Turn on an alarm for 3:30pm today,set
"I have multiple meeting today, remind in 30 minutes interval before the start of each meeting.",set
Set alarm for 6:00 a.m. tomorrow.,set
Add meeting with all employees on March 20 at 9 AM,set
REMIND ABOUT OF ALL EVENT IN CALENDERS,set
Set alarm for tomorrow at 2 pm.,set
I'm going to the theater on Friday at 7 with Dave. Can you add that to my calendar?,set
reminders for doctor visit,set
Set a wake up call for 10 AM.,set
add new event named anna to calendar,set
Add lunch with Laura for Thursday at 1:00,set
Please remind about the [date : tomorrow]'s schedule,set
Remind me every year/week/month on this date of,set
Let me know later.,set
Remind me about my meeting at 2pm,set
set on 22nd march badminton match in merita square,set
Don't let me forget I need a reminder for March 27th at Noon.,set
Remind me about my meeting an hour before it begins.,set
"Add event for this evening, meeting with Jake.",set
My calender is to be updated with all RCCG event in March,set
Set my alarm for 6am,set
"I have an appointment tommorrow, remind me",set
I need an event three days from now scheduled with Amy.,set
Remind me about tomorrow meeting at 10 AM.,set
Schedule my meeting with Mr. John Hopkins tomorrow 1 PM in the afternoon after lunch.,set
add event,set
write in my calendar i have a event for next friday,set
"Hey Olly, place an event in my calendar to go to the doctor on Friday, April 14th at 123 Water Street, New York, NY, 11289.",set
Set reminder for noon to get lunch with boss,set
meeting tuesday noon,set
"Olly, please set work meeting at 12pm for every Thursday in February.",set
Remind me of Rita's birthday 24 hours in advance,set
Add my doctor appointment for the 15th.,set
DAY AFTE DAY TOMAROW WILL CONDUCT ALL MEETINGS,set
PDA please schedule a meeting for me.,set
olly add my upcoming meeting to my calendar,set
set a reminder,set
Add shopping to my calendar for tomorrow.,set
Remind me about meeting next week,set
Every other Monday remind me to take out the recycling,set
remind me to check the oven in 15 minutes.,set
Create an alarm for 6am,set
create repeating event 'john's birthday' on calendar,set
add date and time in calender with these people,set
ESS WEEK KI SABHI IMPORTANT EVENT KO NOTE KARO.,set
add to calendar and repeat,set
"Remind me to water my plants every Tuesday, Thursday, and Saturday.",set
put alarm on,set
I have a flight to take on the 15th,set
please add my next meeting,set
"Bring up calendar and schedule meeting with Ri, April 1st 10AM",set
Add to my calendar daily call at 5pm,set
Give me an update on the election tomorrow at noon.,set
Remind me a week before my credit card payment is due.,set
please set event on monday,set
"I've got an important meeting this Sunday noon 2.00PM, don't forget to remind me",set
I have a meeting at noon today,set
set a reminder for james' party on the third,set
change alarm to start at,set
get ready for the upcoming meeting before the given time,set
"Hey Olly, send a meeting invite to Mr. Ross for this Friday's meeting and block my calendar for Friday afternoon.",set
remind me to get milk [date : tomorrow],set
add events,set
Set event on recurring,set
Change moms birthday event to repeat every year on same day,set
The event ... will include ... and ...,set
Remind me 2 hours before my Wednesday meeting with Linda,set
NEXT MONTH MY BROTHERS BIRTHDAY,set
Set the Alarm tone,set
remind me of my meeting tomorrow at 10:00AM,set
add event in calendar and mention others,set
remind me about tomorrows lunch meeting at 1,set
Set reminder notification for three o'clock,set
Create a meeting thursday afternoon for budget review,set
Tell me when I have an event,set
Set up a daily reminder for me.,set
Remind me about Tuesday meeting with client at 10 am.,set
change the time,set
Add payday to my calendar for every other Thursday.,set
PDA set this date to repeat reminder,set
meeting with Love the next day,set
6AM,set
Set an alarm for 5 minutes from now.,set
set a remainder at 3pm to pick jo,set
When is my husband's birthday this year?,set
Schedule a meeting with the vice president on Monday.,set
"Hey Olly, Please set a reminder for tomorrow morning 10 am meeting",set
Remind me about my next meeting with joe one hour before,set
meeting this monday,set
Remind me to pick up the laundry next Monday,set
"Hey Olly, please set multiple reminders in an interval of half an hour prior to 10 am meeting",set
Add practice to calendar on Feb 4 at King's Park at 2 p.m..,set
Add a party in NY city for this saturday,set
I need a reminder alarm at 1:00p.,set
Can you remind me [date : tomorrow] morning about my dinner plans for the weekend?,set
set alarm for saturday,set
Block one hour from 10 tomorrow morning.,set
set an event 'happy birthday john' to repeat on 21-Jan-2017,set
Set reminder to print the documents on Tuesday morning,set
please wake me up at 7:30 am,set
put alarm at 5 AM,set
I am going [date : tomorrow] for a function,set
Set a meeting between myself and John at 2pm tomorrow.,set
Just set me reminders about pending payment of childreen school fees,set
please add my pay days,set
include MIke and jack to festival calender,set
Add this event to my calender,set
Make March 18 a repeating appointment for Pearl's birthday.,set
Let me know the day before my trip to California,set
set a remainder for 12 pm for lunch,set
please set an alarm for tomorrows meeting at 7:00 a.m.,set
"Ok Google, I need a meeting with the CFO on Thursday.",set
remind upcoming meeting with eminem,set
Set a reminder to go to movies with Ron on March 27,set
set an alarm at 6 in the morning,set
popup meeting,set
meetings,set
"Olly, open alarm and create an alert for ten a.m.",set
Set reminder for atleast 20 times for this calender event which i svery important,set
Set me a reminder for the get-together with the women's club on Sunday after church.,set
Make me alert in the morning about [date : tomorrow]'s meeting,set
Schedule meeting on,set
Set Yoga to a repeating event every monday,set
Add dinner with wife [date : tomorrow] at 7 PM,set
Olly remind me my mom's birthday a week before,set
Remind me at work to take a meeting with Dave on Friday.,set
Do I need to be reminded of any meetings on Monday?,set
Please add an appointment at 9am wednesday at dr greens office,set
I want my PDA to tell me when a new anime season will come out,set
Remind me to get laundry done [date : tomorrow] 7 PM,set
Give me an update on the election in one hour.,set
Remind me about meeting at 8am to 12pm,set
Add running to my calendar for thursday.,set
Alter Lunch Event to repeat every Friday,set
meeting ___ set reminder,set
"set an alarm on Wednesday noon, so I can register for early adopters program",set
Calendar invite for breakfast with Sarah at 8am,set
Click Save.,set
Thursday at 3:00pm there is a teachers meeting I need to be reminded of.,set
recollect nextweek GM's meeting,set
Add work out to the calendar for Monday through Friday from 5 to 6:00 a.m.,set
Wake me up every weekday at 7,set
write this event to my calender,set
Please put my birthday party on the calendar.,set
Alert me at  0500 hrs,set
pls add a birthday party on saturday evening,set
Please schedule an appointment at my doctor for a prostate exam on Friday.,set
remind me at 8pm to do laundry,set
Set alarm on 10th November for 9o clock,set
Set up a reoccurring grocery store trip for every Sunday,set
can you schedule a meeting with Mr. Chen on next Monday 6:00pm?,set
can you set the alarm for 1:30,set
set event date in calendar with ohers,set
Open memo add note about my meeting,set
"I will attend Lily's Wedding next week with my boyfriend, please add it to my calendar",set
Tell me when my next doctors appointment is?,set
Add my car payment on the 12th in my calendar.,set
Set alarm for this event reminder repeating for 10 times.,set
I need you to get me up at 6am,set
set a reminder for wishing a friend tommorrow at 10 AM,set
"I have to go to a meting on friday at noon, can you remind me?",set
Just let me know the important appointments with dealers over the week,set
Set a repeating reminder alarm for the Facebook event I have to attend on 7th April.,set
"Cortana, let me know when a next event if occurring from my calendar and send me a notification.",set
Please add meeting to my calendar,set
Set a reminder for an hour from now about the chickens,set
Please schedule meeting with Ri at 10AM on April 1st,set
i finished it once,set
repeat birthday,set
Set calendar info for albert's marriage,set
Remind me tomorrow morning of my schedules for Tuesday,set
yes its must,set
add a reminder of a conference for tomorrow in new york,set
Mark on my calender,set
I need to calendar a meeting with Allison on Monday at 10am.,set
Please set a reminder of Raju marriage on 31/03/2017,set
on january 25 set meeting for XXX,set
Make a repeting reminder for this calender event.,set
set a new event,set
Remind me of meeting time at 7pm next Monday,set
Notify me the day before the horse race at Santa Anita on March 7th.,set
Make sure to remind me to pay my bills tomorrow morning.,set
PLEASE TELL ME TO TAKE MY UMBERALA BECAUSE IT WILL BE VERY HOT TODAY.,set
"In the Repeat section, enter a start date.Choose the drop-down next to Weekly to change the recurring event to a Daily,",set
Create a meeting event in my calendar.,set
"Thirteen minutes from now, remind me to drive to the park",set
alarm set,set
Please add brunch with Erin to my calendar at the Diner,set
set alarm on 25th may at 5 pm,set
Set an event for this Sunday and the next two Sundays that I have Yoga at 12:00 pm,set
Set my alarm for Tuesday at 6pm.,set
Please schedule a hair cutting appointment for 1:00 pm on Saturday.,set
Set a timer at 5 Am 7 days a week,set
calendar event,set
Wake me up at 5:00 am,set
create event,set
Remind me to pick up John from the airport tonight at 8,set
please set an alarm for me 9a,set
"Add an event starting at 3 PM in Goshen, New York on May 5th for Dan's Graduation.",set
Set a reminder for this,set
Make an alarm for the morning.,set
Remind me to have launch with boss today at 1 pm.,set
Set new alarm on 5 am,set
Add to calendar a home visit everyday this week,set
remember me my child's birthday,set
on 23rd march i have to go to meet my aunt.,set
Mike and Jack should be added to festival calender,set
PDA can you remind me to take the garbage out on Tuesday.,set
Meeting with Joanne in 10 minutes in the conference room,set
Set the alarm for two hours from now,set
Olly set the Alarm,set
"Olly, its Jim's birthday on 2nd March, mark it in your calendar.",set
add meeting reminder for Sunday with my parents in law,set
Remind me of my dentist appointment in two hours,set
blot me the dentist appointment on Tuesday 21 March 2017,set
Set reminder,set
expectations,set
set alarm for morning 6,set
"PDA, Set an alarm for...",set
Set my alarm for 6 am tomorrow.,set
remind me about this tomorrow,set
hi to all,set
Can you remind me of the meeting today at 4 p.m.?,set
Please remind me to go to the post office.,set
set a reminder today at 1:00pm to send the presentation,set
set a remainder of the day,set
Add 'event' to my calendar,set
note this event to my calender,set
Please set a meeting for <insert date and time> on my calendar,set
remind me about calendar,set
Add reminder today evening to collect the parcel from Jakes bristo,set
Add to calendar October 1st at 2pm lunch with Ann.,set
Wake me up at this time,set
Remind me when the concert tickets go on sale,set
Remind me on 5th March of every year to arrange wedding anniversary presents,set
Can you remind me to 'something' in 'sometime'.,set
List out the upcoming meeting,set
meeting reminder,set
notification of meeting on Wednesday,set
find me a time for a meeting with Allen on tomorrow,set
send apologies to all the attendees of the upcomming Tavern lunch,set
MAKE NEW SHCEDULE FOR TOMORROW MEETING,set
meeting this friday,set
Wake me up at 5 Am every morning,set
PLEASE SET ALARM FOR ALL DAYS,set
"PDA, mark sarahs b-day party on the 12th",set
Pleas set a reminder for a meeting I have on Tuesday next week.,set
wake me up at eight o'clock,set
Set me a meeting next Tuesday at 11am with Jesse.,set
Add Bubbles birthday to March 15,set
"PDA, please add this to my calender",set
please remind me about the event later 5pm.,set
Set Bob's birthday for every June 3th,set
Remind me the meeting with Allen on 15th match,set
Open the calendar and create a new event,set
Schedule my meeting with Tom Cruise today evening at 6 PM.,set
I need an alarm for <insert time> can you please set one for me,set
Fill my calender with a meeting with Garvin and Trilly for December 5th  at 5:30 p.m.,set
Remind me to go to the gym every monday and tuesday,set
Please remind me about the 11am business meet,set
"Ok Google, I need to set up a meeting with the CEO [date : tomorrow]",set
Please set a monthly reminder for paying rent.,set
Make a schedule for meeting with our customer next week.,set
Make Wednesday evening at 5pm always be a meeting with Phil on my calendar.,set
Please set the alarm for next Friday at 6:30 am,set
I want my PDA to find free movies online for me,set
google calendar. add event for march 21st,set
blot me all the phone calls planned for the morning of 23 March,set
Can you remind me to order the Turkey three weeks before Thanksgiving?,set
Remind me to go to dinner with Dave on friday at 5:00PM,set
Remind me about the meeting in 1 hour.,set
"I have a meeting by 2 pm today, please remind me.",set
Set alarm of only monday morning 6 a. m.,set
Remind me of Sarah's birthday three days ahead of time.,set
add a note to attend,set
please set a reminder for the office party next saturday?,set
remind this event in future,set
"New calendar entry, meeting",set
remind me of my meeting at 5:00pm,set
Place Event X in my calendar every Tuesday.,set
Remember to remind me about client meet at 4 pm.,set
set reminder anna for every monday,set
please remind me for the function at miami tomorrow,set
Remind me about my Monday meeting with Peter Francis fifteen minutes before the meeting.,set
set my alarm for 12pm,set
Set a calendar event,set
PDA I want to go to Sally's Brithday on Saturday at 10pm,set
Remind me later.,set
Remind me if I miss my evening walk routine,set
make appointment for next friday,set
Set the reminder for upcoming meeting,set
Set notifications on the current weather disasters in america.,set
Add dentist appointment for Friday at 5,set
Repeat this event every Friday on my calendar.,set
create an event 'gym day' on monday and set it to repeat,set
set an alarm for next tuesdays meeting,set
Set reminder for meeting at 3pm tomorrow,set
fix an alam,set
I need a 6 AM wakeup call.,set
make an alarm for fridays meeting at 10am,set
add tal meeting on 21st at 7,set
set my alarm please,set
Remind me in two days to check my emails.,set
please set the alarm for next morning to 7 am,set
"Olly, set a reminder for my meeting today.",set
Add remember to call Mom to my reminders.,set
Set reminder to pick up kids on weekdays at 3pm,set
"Set an alarm for tomorrow, Monday at 8am",set
Set a reminder to pick up food this Friday.,set
Inform my group that the new meeting date is tomorrow.,set
Conduct meeting on Thursday,set
I would like to attend church every Sunday at 11am.,set
Set reminder for date night with husband next Friday,set
olly put my doctors appointment on the calendar,set
Set alarm at 5:00 am,set
Set a timer for 5 minutes for cookies,set
remind me at 5:00pm that I have a meeting,set
Please remind me to pickup John at school today at 1 pm.,set
Add event every second Friday of the month,set
open calendar,set
Set a meeting for tomorrow,set
Please remind me about the meeting with Julie at 5 pm this evening.,set
set alarm for tomorrow morning at 6 am,set
Remind me to pay my bills at the start of every month,set
Add event with these people,set
set alarm for 03/06/2017 at 5am,set
repeating event meeting on mondays,set
add a 5 am alarm in place of my 9 pm alarm,set
Remind me to start the crock pot at 2:00 PM,set
Get me up in half an hour,set
"Every other Wednesday, remind me to go grocery shopping.",set
Remember me to meet Reveca today at 6:00pm,set
'exhibition 2017 mass' on Mar 25 make a note of it on the corresponding date.,set
Set a reminder for the meeting every Monday at 2pm,set
Research the clients that will attend the meeting,set
Set my alarm for time,set
set repeat event in calendar,set
Remind me I need to be at the library a week from today at five.,set
Mike will send me an email tomorrow. Can you please set up an alarm 15 minutes after receiving that email?,set
Add 'meet with Dave' at Subway on Weber on 4 April at 5pm.,set
attend party with Love this friday,set
Please feed that I have meeting at 5 PM.,set
REMIND THE REQURIED EVENTS TO BE RESET,set
shedule a reminder one hour before the meeting,set
Set a monthly event.,set
Will you please set the alarm for [date : tomorrow] 5 am.,set
remind me at the time of the event,set
Enter a reminder in my calendar for 3pm meeting tomorrow.,set
Jack birthday is on 15th march set a reminder,set
Make a reminder at 1PM every Monday until I I remove it.,set
Tell me later to file the invoice,set
add event for date and time with these people,set
Add Mike and Jack to festival calender,set
schedule an alarm for next weeks dentist appointment,set
Can you enter an event to my calendar?,set
set my cooking classes on Tuesdays at 5pm,set
"Ok Google, schedule a meeting with the VP of the department on 3/21/2017",set
add to calender on this date and time with these people,set
Set event in the calendar.,set
set alarm for reminder,set
make an alarm for 4pm,set
Please set a reminder in my calendar for my meeting on March 25.,set
Remind me about my anniversary in one day advance.,set
Set reminder for three o'clock,set
REMAIN DAY AFTER EVENTS IN CALANDER,set
New calendar event for albert's marriage,set
Remind me daily at 11 AM for meeting with boss,set
add an event,set
Let me know when my meetings are on Monday.,set
turn my morning alarm on,set
add [event] to [date],set
"Hey Olly, place an event in my calendar to go to the dentist on Friday, April 7th at 450 Park Avenue, new york, ny, 11232.",set
Set an alarm for me for <insert time>,set
"Olly, can you please add my dinner reservations to my calender?",set
Activate a 1 week notification before my anniversary please.,set
Set reminder for 2pm about my meeting.,set
Add a lunch date to my calender for March 15th from 12 noon to 1pm,set
"Hey Olly, turn on your reminders for tomorrow's meeting at 10 am.",set
Give me a reminder 24 hours before my Friday meeting with EDG,set
Add my sister on calendar for pedicures on Friday.,set
"Olly, please set lunch meeting at 12pm for every Wednesday in March.",set
remind me to start getting ready by 5 pm please,set
Please alert me.,set
Will you remind me of the dentist appointment I have in two hours?,set
reschedule meeting,set
Remind me every tuesday to go to the dry cleaners.,set
Please set the alarm for [date : tomorrow] 5 am.,set
Remind me about my business meeting at 3:45pm,set
please ring the wake up alarm at 8 am next saturday,set
Let me know when the meeting is gonna happen.,set
Meet James at Mill Creek Cinema in McKinleyville California at 9pm,set
Remind me to call the bank next Thursday,set
"Schedule lunch at Tomo in Arcata, California tomorrow at noon.",set
I need an alarm.,set
Remind me if anything else happens,set
"I need a birthday reminder for tomorrow, add one",set
Remind me to take my medicine every day at 7PM for the next two weeks.,set
Mark next Tuesday in my calendar as Steve's birthday.,set
"Alexa, remind me daily about Inauguration Function",set
Set my calendar to remind me to buy groceries every Friday.,set
Remind me to buy a gift once in morning and once in evening,set
olly write down meeting at 7pm,set
can you add this event with karl?,set
set roatating event,set
remind me tommorrow at 10 AM to wish my friend,set
Set soccer game with Mark in my calendar for Tuesday night.,set
set reminder for 4pm tomorrow,set
ensure I have to get up at 6 in mornning,set
"Check calendar for Thursday at 2pm, if I'm free, please set a meeting with Mr Fox.",set
alert,set
wake me up at 4am,set
Set a meeting with Mr Fox for Thursday at 2pm.,set
Repeat daily activity.,set
set alarm half an hour from my meal time.,set
I need to set a reminder to go to a work meeting on friday at 2:00PM.,set
Set an alarm for the meeting tomorrow 30 minutes before the event starts,set
Alert me at 2:30.,set
"pencil me in for sarahs birthday thing on the 12th, PDA.",set
Do add this on my calender PDA!,set
Remind me that I have a meeting at 3pm tomorrow.,set
set an alarm for seven thirty a.m.,set
set reminder for tomorrows meeting with {client name},set
Send me notice of meeting Wednesday 9 am.,set
Add a new event for tomorrow at 5pm - Meet Sarah at the gym,set
wake me up at 6 am,set
Please add a 4 p.m. appointment for every Tuesday.,set
Change my alarms to Mountain time,set
Could you please create a new event on my calendar ?,set
Please add dinner plans to my calendar for (specific date/time) at (specific location),set
add to calendar new event 'thanksgiving',set
Remind me the wedding on time to buy a present,set
Set a reminder for my daughters birthday.,set
Please remind me to take off coffee off stove in 10 minutes,set
create reminder for laundry at 8pm,set
Set a meeting with Tom on Tuesday at 9am.,set
Schedule dinner with Sara and Jamie,set
set a reminder for the 23rd,set
Olly mark 1st january as new year event for every day,set
Add a meeting tomorrow with a Pamela at 6,set
Olly set a lunch date for next Tuesday at noon with Sarah at Black Angus.,set
Please set an alarm at 7:00 am tomorrow morning?,set
Schedule business meeting with work group.,set
Send invites to Mike and Jane for the 9am Saturday appointment,set
I want to add an event to my calendar,set
Create a notification reminder for meeting tomorrow,set
I need to be reminded that there is a meeting for Paul's retirement. Set reminder for Tuesday at 3 pm.,set
Remind me in the future of this,set
"Olly, please set dinner plans at 7pm for every Friday in April.",set
Schedule a meeting with Reeta today evening at 5 PM,set
Set a reminder of meeting at 9 am tomorrow.,set
"Open Google Calendar. In the My calendars section, click the down arrow that appears when you hover over your calendar, and select Reminders and notifications from the drop-down.",set
PLEASE SET ALARAM TO MY MOBIL PHONES,set
Add Yoga class at noon to my schedule for the next three Sundays.,set
set a daily meeting for 8am,set
Set a reminder for a meeting at 2pm tomorrow between myself and John.,set
Please put me your input to know my schedule,set
Notify me when this meeting is close.,set
remind me in 50minutes,set
"Add on calendar: birthday party tomorrow, 2pm, for Jane, at her house",set
Remind me of this meeting soon.,set
Please set an event at 10 am one month and two days from now to have a garage sale at my house,set
Repeat Reminder for my appointments for Christmas,set
Could you please set an alarm at 6 am?,set
PDA can you remind me to meet with Jesse next Saturday.,set
I want a reminder that repeats every week.,set
I need to set up a recurring event in my calendar please,set
hello Google! can you set a recurring event in my calendar for me?,set
Set event on repeat,set
"Alexa, what is on my calendar for today",set
Please block off Friday at 8 am on my calendar.,set
Please set a reminder for church services on Sundays for 11am.,set
I want to set an alarm when I'm driving home tomorrow to remember to stop at the store and get food.,set
Set alarm for 8 am tomorrow,set
remind me before monday.,set
the calendar event has multiple people,set
set an alarm for 12,set
I Would ask it to play the beep sound continuously,set
"hey PDA, make sure I go to sarahs birthday party on the 12th.",set
Church with Mom and Dad on Sunday.,set
Set a reminder to x thing every x days.,set
I would like a wake up alarm at 7:00 am tomorrow.,set
Remind me of my appointment on the 15th.,set
Put my brother's birthday in my calendar for July 4th.,set
I need a repeating reminder for every Monday at 3:30 p.m.,set
Set any appointment for this event in my calendar.,set
can you remind me to go to dentist appointment one day before?,set
Add a reminder to my calendar every year/month/week on this date,set
Remind me to read book next week,set
set alArm,set
olly i need that appointment posted to the calendar,set
Set up a meeting [date : tomorrow] morning at 9 o'clock o'clock and invite John,set
I need to add baseball practice on Saturday at  two pm.,set
Notify me of the meeting on tuesday,set
Please give me an update on the election every 30 minutes.,set
Set alarm of Whole week morning 10 a. m. in april month,set
Remind me to meet James at work tomorrow at 9am,set
Calendar 6 o'clock departure [date : tomorrow] morning with Mike and Jo,set
Create a new event on my calendar,set
alert me at 3pm to goto the concert,set
Set an event,set
Can you set the location to my sisters house for this event?,set
add event,set
Add (name/location) to calendar,set
set a reminder alerm for my 5pm meeting please,set
set alarm for 6 am everyday,set
Schedule lunch with mom on tuesday of this month.,set
remind me of meeting 5 minutes before time,set
make alarm reminder for calendar,set
Create a new daily event.,set
add event ann to calandar,set
Please schedule a meeting with my secretary,set
Set a event that will happen everyday.,set
Let me know on Tuesday if I have messages.,set
Please set a reminder for me to 'something' in 'sometime',set
remind me tomorrow at 10am about the meeting,set
wake me up at 9am on Friday,set
Enter event for Mondays only,set
add birthday to every year,set
Remind me of the meeting on 1/22,set
Attitude,set
Remind me of my 3pm meetng tomorrow 4 hours in advance.,set
Turn on my alarm,set
set an alarm for 2pm,set
mark 13 october of this year as my birthday,set
Send me an alert and hour before my next appointment.,set
