Just see for me the alarms that you have set today morning.,query
Can you update me and let me know when my appointment is on x day?,query
"Between May 1 and December 31, what meetings occurred",query
what is the status of my order no?,query
Give a last minute update on incoming emails please.,query
Check how many likes did I got on my most recent post?,query
Make a list of all the clothing range available on Ralph & Lauren.,query
Can you find my lists?,query
What do I have scheduled for next week?,query
check weather,query
give me news on president trump,query
more about the concert in St. Pete,query
Report weather for 33774.,query
Is it someones birthday or anniversary today?,query
Did we get any update from the new provider?,query
weather for remchi city,query
Did I recieve any emails from Tori?,query
Does the restaurant have carryout?,query
Show me today all train times of next 2 hours at Jodhpur to Jaisalmer.,query
Do I have emails,query
Please tell me what lists I have.,query
Look to see if Luigi's has take-a-way.,query
"Could you open my list app and check for groceries, please",query
Where is an Olive Garden that does takeaway?,query
Olly tell me what lists I currently have,query
what's going on in Congress,query
Is the song by Shakira?,query
sunday,query
Please show my list,query
Tell me about UMF,query
Tell me today's newspaper's headlines,query
hey siri tell my today's top news,query
Can you tell me about the meetings that have occured this month?,query
Please read me headlines from Washington Post,query
How many emails do I have in the last 15 minutes?,query
How long until my takeaway.,query
Show me weather list for tomorrow,query
Brief me about  today's football match,query
What items did I plan to buy?,query
What events are happening between 2-4pm today?,query
How are things in the world?,query
Who is the artist of this song?,query
What day this year has the longest daylight time,query
Is it a rainy and stormy day?,query
"Alexa, give me updates on the presidential candidate race.",query
What alarms do I have set right now?,query
what is the time in London now,query
can you get me a train ticket to NYC?,query
should I wear rainboots,query
How many more reminders are left?,query
Tell me this song,query
Please check third event of 22/03/2017,query
Is there anything important happening on social media,query
"Olly, find out what song this is and tell me the name.",query
What is on this list,query
What is the list about my my favorite songs,query
find coding tutorials,query
Please give me update of cricket,query
Please find new from CNN,query
show me the most recent emails,query
What's the latest news from T-mobile?,query
How do I get to the train station for a ticket,query
"Hey PDA, Did i get any new emails?",query
PLEASE TELL ME WHAT IS THE ELECTION RESULT TODAY HAPPENED.,query
read email subject chemistry,query
What kind of weather should I expect this week?,query
mention the thing in the list,query
Show the list of upcoming events,query
give me the reminders,query
is there a birthday party today?,query
Inform me of my new emails,query
get me the news from XYZ news,query
Is it colder than yesterday?,query
"Alexa, what's the news for today?",query
I want to know if The Olive Garden provides takeaway.,query
may i know the about alarm you set,query
"Will the temperature stay about the same, or is it going to get colder?",query
Does the 13th have rain in the forecast?,query
did you receive this person email?,query
Check out my to do list.,query
What is the current time right now?,query
What day of the week is Thanksgiving?,query
Is there anything new in my email folder?,query
Show me news from CNN for today.,query
When is my next event?,query
Show me the list of pending meetings.,query
Is today going to be sunny?,query
Olly does Sarah have a new email address listed?,query
can you tell me what time is it,query
What are my new contact emails?,query
check yahoo mail,query
tell me a date,query
Tell me about all pending reminders.,query
where are my takeaway order?,query
What's my calendar today,query
Show me the shortest route towards nearest train station.,query
Is there any party on my calendar for this weekend?,query
directions to sainsburys.,query
"what is the weather ( if i want to know the local weather, I will not mention the city)",query
do i have any remainder next sunday,query
tell me how are the results of assembly elections in Delhi going to come out?,query
Show me the train schedules to the Metropolitan Opera House.,query
"PDA, has my calendar been update in the last 10 minutes?",query
COULD YOU PLEASE TELL WHEN WE HAVE TO PAY FOR CAR INSURANCE?,query
"Tell me the percentage of the chance of rain in Seattle, Washington for today.",query
Is there any news of the newest game coming out.,query
"I have my lists, right? What are they?",query
Weather report of Boston,query
confirm alarm for tomorrow morning,query
Does Peking Garden deliver?,query
is my daughter's play friday night?,query
Show me my last email?,query
Show me my playlist,query
what's date today,query
What's the current time in New York?,query
What is going on with blank?,query
Give me the weather for the last five days.,query
"Olly, Do i need to bring a coat today?",query
News from State Paper,query
"What's the current time in Orlando, FL?",query
tell me about the meeting i have this week,query
Take me to the most popular post.,query
show me my social media notifications,query
how many hours gone from midnight on  city.,query
"Olly, what is the most recent update regarding the hurricane Katrina?",query
Give me the weather forecast for this week.,query
list all train times to ny,query
99.9 FM is currently playing what music?,query
date and time,query
May I know what is trending in Facebook?,query
Bring up my email.,query
Is it snowing in Seattle?,query
current time in NY,query
this song is composed by whom?,query
10 day forecast,query
Finance,query
Is the time currently correct for where I am located?,query
Does Fongs do carry out?,query
How long it lasted?,query
Do I have any new friend requests?,query
What is the time in the Pacific time zone at this very moment?,query
What is the time for Jimmy's party?,query
Should I wear a short sleeve?,query
"Olly, tell me the pound for pound list for the top 10 in the UFC",query
Is it going to rain today?,query
what is the time in new york,query
How many hours ahead is NYC?,query
what time is it right now?,query
Show the to do list for today,query
Where is my pizza from Domino's at?,query
Are there any events happening next week?,query
what and how is india's economy at the moment?,query
Is the 18th a Monday or a Sunday?,query
"What is the subject of latest email I got, and who sent it?",query
Tell me if anything important is happening on social media today.,query
Can you find me a train ticket to Southampton on Memorial Day weekend?,query
sports head lines pls,query
Can you give me the movie schedule?,query
PDA tell me the current time.,query
Do I have any reminders?,query
File Downloading,query
Do I have to do something later?,query
what does source have to say about topic,query
Do you recognize the song playing on my phone?,query
What is the current temperature and humidity outside,query
When is the school dance junction marked,query
Follow Trump campaign news feed,query
locate address for myrtle beach state fair,query
Are there any new emails?,query
Take me to news from NBC,query
Can you show me all of the emails from my favorites list?,query
Read me the latest international news.,query
"Olly, trending hot news topics.",query
at what time does the next redsox game start,query
what were the first number of email subjects I got today?,query
What did the clinic say about my exams,query
Live Show reminders,query
"PDA, train time from brooklyn to queens.",query
Please let me know the latest business news,query
What day of the week does the 25th July fall on?,query
how is brexit going recently?,query
Is my calendar event right or wrong?,query
Who is the artist of the current playing song?,query
what time does the train from new york come in?,query
Did Tracy update her Facebook status today?,query
tell me news from canada,query
Give me train times from station to location,query
What is up in my schedule today?,query
check recent emails,query
What is currently trending on twitter?,query
search schedules for this week,query
Make sure bread is on my grocery list,query
Please book a ticket on train no:xxx using my debit card,query
Are there any new emails yet?,query
I AM NEED OF AN EVENING RAIN COAT,query
is it anyones birthday,query
what day was it on my birth date?,query
Today weather,query
GMT Time,query
open meeting time,query
Does Monday's meeting at 8am include Chuck Ingerman?,query
Any new emails?,query
get me new email,query
Do I have anything planned for January 19th at 2 pm?,query
What's the description for the alarm at 11am?,query
Tell me about the most recent road construction on route 70?,query
what's the time in Tokyo now,query
is it snowing outside?,query
PDA: Did anyone send me any new emails in the last hour?,query
"PDA, Provide me the alarm times you have set.",query
Are there any reminders set for today?,query
What time are my alarms?,query
Olly get me the popular news from bbc,query
My events,query
What do I have to do on Monday?,query
What are the upcoming concerts in Dallas?,query
Did anybody post on Facebook today?,query
What day of the week does the next holiday fall on?,query
song title?,query
What is happening in the bussiness world,query
What music is playing right now?,query
today's news,query
Visit metronorth.com to help me purchase train tickets,query
What reminders do I have scheduled before noon tomorrow?,query
"Hi there, tell me latest updates of Times of India page in facebook.",query
"PDA: When this story updates, would you let me know please?",query
"Whose song is this, PDA?",query
What is the time in Dubai ?,query
Tell me BBC news,query
what time is it in los angeles,query
When the even was started?,query
What will the weather be like this week?,query
Read the email sent by this contact,query
What is the time difference between here and <insert city>,query
what are my pending tasks?,query
Will it snow next week?,query
My set alarms,query
Can you see if I have any new emails?,query
show me recent news on particular subject,query
Can they do delivery?,query
"display latest emails, Olly",query
Has Tom emailed me about ammunition?,query
Can you please give the overnight low temps for Costa Mesa?,query
is weather normal today?,query
What do I have scheduled today?,query
could you tell me the time in london,query
"Current song playing, what is it?",query
Do I have any notifications,query
Display the local time of London at this moment.,query
Tell me a play lust,query
Will the weather be bad on Sunday?,query
What's on my list today?,query
what is the the meeting schedule,query
Are there unread emails from mom?,query
Do I have any music by Lady Antebellum?,query
Weather in Homestead,query
PDA show all emails sent to me from my boss,query
What music genre do I listen to the most?,query
Do I have any event on my calendar tomorrow morning from 10 to 11?,query
what time zone is this city in,query
Fastest route to Turiellos,query
Olly show unread new emails.,query
Please tell me if I got any email recently,query
Do I have any unread emails from Chris Thompson?,query
Give me the driving directions from faripir to gurpur,query
"Hey, when is the next local from Mumbai to Pune?",query
What is the time in L.A.,query
Do I have a soccer game this weekend?,query
"Tap the System tab. Tap Clock, and then select the Alarms tab. Tap and select the day you want the alarm to sound. Double tap the time displayed on the extreme left to set a time for the alarm,",query
Do you think I can wear sandals or should I wear sneakers tonight at 7pm?,query
provide me news,query
what list I have for today,query
will I be able to see the stars this night?,query
whats today,query
What genre of music is in my music folder?,query
What year is it?,query
can you tell me the time right now?,query
do i need boots today,query
Should I wear sandals or shoes with socks?,query
"Olly, tell me about the weather.",query
"Remember I've ordered a cake for tonight's birthday party, let me know the status please",query
What will the weather be like in two weeks,query
what is the current time in chennai,query
Has Sarah posted anything today?,query
What is the economic policy of trump,query
directions to the target on i-40,query
Headline news for Texas,query
Has the budget been voted on yet?,query
Can I take food home here?,query
When is the next holiday?,query
please tell me the latest news about politics,query
weather in home town,query
Have I received any emails from Tim?,query
PDA: Is today the 4th or the 5th?,query
"When is the last departing train from Boston, Massachusetts.",query
Show me news about the enviroment,query
<List all of my alarms>,query
The 22nd is on what day of the week?,query
Tell me my meetings this Wednesday morning,query
What events are going to happen in my city between 2-4pm today?,query
What is the estimated travel time for the train ride to Orlando?,query
Do I have any new emails from Amazon?,query
What time is my doctor appointment on March 31st?,query
Any email from my client?,query
What's on my schedule for today?,query
check my mail,query
newyork,query
Olly tell me whuch time is it in new york,query
Did anyone send me an email?,query
Give me the release date of this song,query
PDA is it a good day to go to the beach,query
what is my recent email activity?,query
Is it going to rain in Seattle today?,query
weather news,query
Food will be given at the exhibition?,query
where is tommorrows meeting shedulded,query
show me map of this location.,query
"How far of a drive is it from Lexington, Kentucky to Washington D.C.?",query
are there any train times for...,query
check if there any new email.,query
how much is a train ticket to chicago?,query
Will there be sunset at 5:30 pm tomorrow.,query
When was the last meeting?,query
Check emails from MGCCC,query
Will I need an umbrella this week?,query
How much is a round trip  train ticket to go to New York?,query
Give me my reminders for this week?,query
whats going on on fb,query
What unread emails do I have?,query
"wats online, PDA?",query
Give me the date of Monday on third week of this month,query
"How cold is it in Anchorage, Alaska?",query
is it gonna be cloudy,query
Please let me know new emails from Michael,query
whats going on in Japan,query
Weather in Dhaka,query
check emails,query
What's happened in the news recently?,query
Is my school alarm set?,query
what will the weather be on the 7th,query
What are the hearhrob news?,query
I want to know how cold is it outside today?,query
Please send me info on how to go about purchasing a train ticket to New York,query
date,query
Will it be warm enough after lunch to not need my jacket?,query
"PDA, please archive my read messages.",query
is the alarm to the backdoor set and ready to go?,query
Will it be too cold for a dress on Sunday?,query
What song is playing right now?,query
Let me know if I have new emails,query
What do I have to do this week?,query
Band name?,query
Read me my list for [list name],query
"PDA, can you look up train ticket prices for me?",query
Put on the screen the lists I have available.,query
What will bw thr time now in Washington,query
What is planned today?,query
Any update on the topic X.,query
I need to subscribe to the newspaper.,query
What is happening in the world right now? Check BBC.,query
what is my upcoming calendar event,query
Give me the information of today's cricket match,query
What is the latest news on Donald Trump,query
whats the weather like in chicago,query
What are my next 3 events?,query
"Olly, accumulation of snow predictions in buffalo",query
What would be the current time in Ivory Coast?,query
How far is the distance to RCCG ikoyi Lagos from here by train?,query
Will I need a jacket today?,query
When is the next train arriving to Union Station from Grand Central Station?,query
Please tell me the news headlines.,query
The 22nd is what day?,query
WHAT ALARMS ARE SET IN THE HOUSE?,query
When does the next meeting start?,query
who is going to the party?,query
What will the temperatures be for the next week?,query
what train stations close to me also sell tickets,query
get me the latest news in NY,query
Restaurant order status,query
Do I have any appointments?,query
what are the events,query
Directions to New Orleans,query
Show me all the emails I've gotten today.,query
Any breaking news from The Huffington Post?,query
Do I have any alarms,query
Do I need to wear sunscreen today?,query
what are the lists I have?,query
Will they deliver to me ?,query
Show me the latest world news,query
show news of migration,query
"Olly, find me the latest news right now",query
please tell me what is the time in tokyo japan.?,query
What are the most recent developments on (specific topic)?,query
can you show me list of my appointment,query
Please give me the date today?,query
Look up the current time in new york city.,query
What is the five day forecast?,query
What reminders did I set?,query
PDA when is Dale's birthday?,query
how much rain can I expect on date?,query
Did Renee just post to my Facebook feed?,query
Open all mails from Steffi.,query
Is there any news Olly?,query
Tell me Today's direction.,query
where is my meeting at 9AM?,query
what could be the time in india,query
What will be weather for tomorrow in mumbai,query
Play one through ten on U2 list,music
alexa  classic rock,music
Give me a good playlist,music
go to menu,music
Play a jazz music,music
play country,music
Play the Celine Dion song from the Titanic movie.,music
My favorite music please,music
I WANT TO PLAY THAT MUSIC ONE AGAIN.,music
Play a selection of Classical Music.,music
play all rock songs,music
please play the radio gaga song,music
Play some carnatic songs,music
Play 4th song of the same album after this song.,music
Please play song x,music
Play lady now,music
play songs from playlist,music
Start playing Thinking Out Loud now,music
play sanam,music
Play hip hop music,music
Please play Thriller.,music
Play Billy Joel,music
Play all music by Billy Joel,music
Play me some rock,music
reshuffle and play music,music
Play random music,music
Play repeats please,music
Can you find the newest song from MGK?,music
Please play jazz music.,music
I want to hear some Jazz.,music
I'd like to hear Queen's Barcelona,music
Play the first playlist,music
put on some Coldplay,music
play song number,music
play new gaga playlist,music
play a song randomly from my playlist,music
Play my sadness playlist.,music
Run music from this playlist,music
play a melody music,music
I would like to listen to some rap music right now.,music
Please play AR Rahman music,music
Play Rocky Horror Playlist,music
"PDA, play my pop playlist.",music
play the romanitc songs,music
start playing dubstep,music
Make Happy Birthday the next song.,music
Play something by Norah Jones,music
I want to hear [song title],music
play rap,music
I want to Dance to the tune of Raghu Dixit,music
Please play my Top Music playlist.,music
Play Hotel California after this song.,music
play work from home song,music
Play for me the music by Michael Jackson,music
"Olly deathmetal, now!",music
Play Ella Fitzgerals Get Happy,music
Turn on favorite songs.,music
play music by skrillex,music
I want to hear something <insert genre>,music
Search for more songs from the band,music
I need some rap!,music
Can you open beatles,music
Play <song name>,music
play {song title} by {artist},music
play random song from 80s playlist,music
Play the song immediately.,music
Open media player and play my gym playlist,music
play top 10,music
"Go to Pandora, find 21 pilots radio, play please",music
Can you please play Imogen Heap?,music
Continue to next song please.,music
Play my workout playlist in spotify,music
"Echo, play 'I Can't Feel My Face.'",music
mp3 play artist,music
please play some jazz,music
Play rock music please.,music
I want to listen Irene,music
open my Amazon Music app and play my playlist,music
Find Pitbull songs,music
Play Hurts like heaven,music
Show me the best podcast of folk songs having good rating and play it.,music
I want to listen to soft rock.,music
Olly I want to listen to Believer.,music
Play R&B music,music
it's too quiet in here,music
play the song from last night at 6pm,music
lady gaga,music
Play led Zeppelin houses of the holy,music
play something by The Used.,music
Please play Jennifer Lopez album,music
play my most played playlist,music
Play selected music.,music
set a classic 80's music,music
Make a Jars of Clay playlist for me,music
Play list 5,music
"Olly, I need to hear some sad songs today.",music
Play song Aces High,music
play songs by barenaked ladies,music
play old classic music,music
Can you play 24K Magic by Bruno Mars?,music
"Echo, play 'You Are My Sunshine.'",music
Olly Play be warned by tech n9ne,music
I want to hear Radio head please,music
Play my most favorite country song.,music
"Alexa, play song Over the rainbow",music
I would like to hear the theme song to This is Us,music
s,music
Play the next song in the sequence.,music
Play Major Tom by David Bowie,music
d,music
play sword art opening,music
Play some rock music,music
Play the last album on a loop,music
play bob dylan playlist,music
i want to hear surfin usa,music
Start up a Bjork album for me.,music
Let me hear some pop music or a song,music
I want to hear music by a band from my playlist,music
Please play some Lady Gaga.,music
Play sec01 music from good playlist,music
Let's play (specific song/genera/ station),music
Play Jingle Bells next.,music
play sholay,music
choose that music player,music
Play music in Queue,music
Find some 80s rock,music
Play some music from metal genre,music
rock with rock star.,music
Take me to more music by that artist.,music
Turn on the playlist I have decicated to rock music.,music
please play this song,music
i want to hear the songs of Adele,music
Play Boneym,music
Change this song to the first place,music
Please resume my music,music
Alexa play pandora 90's dance party,music
Play the last song from my most recent playlist.,music
play me music,music
Put on a song by Celine Dion,music
i am in the mood for some classical music,music
Open my classical playlist.,music
Play me some melody song,music
Search for all titles for Huey Lewis and play.,music
Hey olly play the songs from my playlist named good tunes,music
Please Play Aretha Franklin's Call Me next.,music
Play it again please,music
Want to play rock,music
play from favorites song no.,music
Play song by Daddy Yankee,music
Can you play me some Skramz,music
Please play my Pop playlist,music
I want to hear country music,music
Put Summer Lovin' in 3rd position in my queue.,music
Alexa play 90's alternative,music
play Third Day,music
"play a mix of rap and rock, one after the other",music
Ennavale adi ennavale,music
Please find music by AFI,music
let me hear some bluegrass music,music
PDA name: play the song xxx xxx,music
Play for me the music by Madonna,music
play melody music in the morning time,music
Play Blackeyed pees song,music
Turn on some music!,music
can you play music by pink floyd?,music
Play something random from Google Play,music
I wan to play me a Justin bieber song,music
I haven't been hearing any King Crimson - please add their first 7 albums.,music
position the top five most listened to songs on my playlist in a queue starting at most listened to,music
open playlist,music
Play any song by Joe Prsaise.,music
Play pop music.,music
play my playlist 'party songs',music
play edm music,music
Listen to music of genre,music
Play my R&B playlist,music
Play adele hello,music
please let me hear 666 the number of the beast,music
Play the latest rock songs having rating of 4 or above.,music
Play jazz music now.,music
Can you play my music,music
menu,music
Play song after this,music
Play Jump by Van Halen when this song is over,music
I want to hear any songs that got grammys this year,music
I want reggae.,music
I want to listen to Rock,music
play music from my favorite artist,music
I need a song to calm me.,music
Hey siri play a nine inch nails album,music
Play Romantic playlist,music
Play latest country music releases,music
"Olly, I feel like dancing, play me some rock n roll.",music
Please play anything by AFI,music
I like to listen to Jazz,music
Next play Justin Bieber's Sorry.,music
Next play selected song,music
PLEASE PLAY THE LATEST SONG FROM THE ALBUM ABBAS.,music
Can you open my itunes?,music
I want to hear x playlist next,music
vanilli marauthr,music
Play mp playlist from start,music
play popular dance music,music
"pause, put this song on after this song",music
"I'dl like to hear any classical, except for bach or schubert",music
please turn on the music i want to hear my favorites songs,music
turn  on music by seal,music
All music released between 1990 and 2000 is only to played.,music
"Alexa, play Over the rainbow",music
play 60,music
Can you make my music file to play?,music
olly i want to hear some rap please,music
Please select the first song in my iTunes library.,music
lets hear some groovy tunes,music
turn on surfin usa,music
R&B music,music
"I WANT TO LISTON ARIJIT'S SONGS, PLZ TUNE THAT.",music
PDA: Would you start my evening playlist,music
"I am really feeling depressed right now, can you please play my most played songs to cheer me up?",music
Play the last played playlist,music
Please play Shake It Off by Taylor Swift.M,music
Play my dance music playlist,music
Start playing music.,music
I WANT YOU TO PLAY MY MICHAEL JACKSON FAVORITE SONG.,music
play the song which is in movie rangoon.,music
Play Jack Johnson playlist music,music
Find and queue all songs of Kate Perry and play all without shuffling.,music
Play the pre-gaming playlist,music
