Set up a meeting with my sons teacher for Friday.,set
Research the clients that will attend the meeting,set
Remind me to pay rent every month,set
Add Event on Ausgut 21 at 9am,set
Repeat calendar event.,set
write this event to my calender,set
"On the fifth of November, I need to go to Washington, D.C.",set
reminder set,set
"Olly, create an empty calendar event for next Saturday at ten a.m.",set
I want a reminder for an editor's meeting at 2 pm Thursday.,set
Remind me to check the stew at 6 o'clock,set
Schedule a meeting event in my calendar.,set
Set a meeting with Tom on Tuesday at 9am.,set
Add dinner with my sister on March 18th,set
Remind me at work to take a meeting with Dave on Friday.,set
Remind me 2 hours before my Wednesday meeting with Linda,set
Create an event with Zaf,set
can you put Sunday hockey class in my calendar as recurrent event?,set
Please set my alarm.,set
PDA I want to go to Sally's Brithday on Saturday at 10pm,set
Calender henvich marriage,set
"I have a meeting tomorrow at 5pm with the development team, don't forget to remind me an hour earlier.",set
please schedule a meeting with this person,set
"Please invite Kim, Marc, and Julian to a meeting on thursday at 3pm",set
I want you to make alert in the evening about upcoming meeting,set
I need to get up at ten tomorrow.,set
MAKE NEW SHCEDULE FOR TOMORROW MEETING,set
On October 1st at 2pm lunch with Ann,set
Remind me about my lunch date for Monday.,set
Remind me when I am at the library to get a new library card,set
Remind me to go to the gym every monday and tuesday,set
Let me know when it is 10:00.,set
NOTE DOWN THIS EVENT ON MY CALENDAR.,set
Remind me about Mike's birtdays,set
Notify me about birthdays of all my facebook friends.,set
Include this event in my calendar.,set
"For a new event or meeting request, choose Repeat on the toolbar.",set
Set my alarm for 6 am tomorrow.,set
New notification for meeting in two hours.,set
"If my package shows that it is for delivery tomorrow, can you set up an alarm 1 hour after? Thank you!",set
Place Event X in my calendar every Tuesday.,set
Make a meeting with Tom around 9am on Tuesday.,set
add new event to calendar and name as anna,set
Add to my calendar: mom's fashion dinner for May fifth.,set
Please mark my calendar for therapy every Tuesday at 11 AM.,set
Add a meeting with... to my calendar and...,set
Add appointment with dentist [date : tomorrow],set
Add Bola birthday of 12th July to my calender,set
"Hey Olly, place an event in my calendar to go to soccer practice on Friday, April 21st at 1190 Whale Avenue, New York, NY, 11292.",set
Don't let me forget to [action] before [time],set
set alarm for 8 every weekday,set
remind me of meeting 5 minutes before time,set
Is my alarm set for 7:00 am?,set
remind me after a month,set
Mark my budget meeting down for every Friday at 2.,set
Notify me when I have a meeting.,set
Let me know when three hours have passed.,set
remind my meetings,set
"Open calendar, add event, meeting, invite Bill, Malinda",set
please remind me my doctor appointment on 13th July?,set
Please block off Friday at 8 am on my calendar.,set
marriage day,set
DAY AFTE DAY TOMAROW WILL CONDUCT ALL MEETINGS,set
setting repeating event in calendar,set
remind me about this,set
turn on an alarm for 9am,set
Set a reminder every day at noon to take medciation.,set
set an alarm for me for tomorrow,set
Remind me the meeting with Allen on 15th match,set
Put reminder to call Pawel tomorrow,set
please add my pay days,set
Please alert me a day before Jeff's birthday.,set
Ask Joe and Joanne if they can attend tomorrow's meeting at 11am,set
remind me for tomorrow dinner,set
Save the date October 1st Ann and I are going to lunch at 2pm,set
Remind me two hours before 6pm that I have to wake up at 4 am friday morning,set
Please put my birthday party on the calendar.,set
Please set alarm for,set
Make a repeting reminder for this calender event.,set
"i want to do laundy at 8pm, create reminder",set
set a meeting on the 20th oct 10:30 am,set
"Hey Olly, place an event in my calendar to go to the doctor on Friday, April 14th at 123 Water Street, New York, NY, 11289.",set
google calendar,set
recall me wedding anniversary day,set
"In the Choose how you would like to be notified section, check the Email box for each type of notification you├ö├ç├ûd like to receive.",set
Repeat Reminder for my appointments for Christmas,set
See if... is available for a meeting on Monday.,set
write in my calendar i have a event for next friday,set
Create a notification reminder for meeting tomorrow,set
meeting the next day,set
Set alarm of Whole week morning 10 a. m. in april month,set
create a birthday wish reminder for tommorrow at 10 AM,set
I need to let my small group know the location has changed,set
Set an alarm for time,set
Set reminder to print the documents on Tuesday morning,set
fixed an time for reminder,set
Set a reminder of meeting at 9 am tomorrow.,set
Set a meeting on Wednesday at 3pm in room G30.,set
family bonding before meeting,set
put alarm on,set
Set a reminder for two days prior of the event,set
alexa remind me to go to my doctors at 4pm on tuesday,set
remind me to take out the trash,set
make an alarm,set
10AM,set
Make a repeating reminder for tomorrow,set
Schedule a meeting on Tuesday,set
turn my morning alarm on,set
"PDA, add event to calender.",set
Can you set the event for monday at 6 at mcdonalds,set
Remember to fix a meeting between me and the players tomorrow evening by 7.,set
Remind me what I am doing on Sunday afternoon,set
Please add an event to my calendar.,set
Set the time,set
Create a reminder for Visa application on this Thursday,set
make alarm reminder for calendar,set
set alarm for noon tomorrow,set
Add 'event' to my calendar,set
PDA can you set up a meeting with me.,set
please wake me up at 7:30 am,set
Add an event to my google calendar for the date march 22nd please,set
Remind me to go to dinner with Dave on friday at 5:00PM,set
Please set my alarm clock for 8am,set
remind me after 10mins,set
Add remainder,set
Set a reminder for Tomorrow for meeting with Allen,set
Give me an update on the election tomorrow at noon.,set
Schedule dinner with Sara and Jamie,set
Remind me to pick up Linda at 5 in the evening on 7th.,set
"Olly, can you please add my dinner reservations to my calender?",set
set an alarm at 10 tomorrow to remind me a meeting,set
"I have a meeting, set a reminder for 4/9",set
wake me up at 4am,set
Add my car payment on the 12th in my calendar.,set
tuesday lunch meeting,set
Set alarm of every Tuesday of march month morning 8 a. m.,set
Block off 3 to 5 on friday,set
its ok,set
When is my meeting?,set
Get me up at 8 AM.,set
Set a reminder to pick up food this Friday.,set
The event ... will include ... and ...,set
Let me know when my phone is due.,set
Set alarm for tomorrow at 2 pm.,set
Please add dinner with Mary to my calendar on Saturday.,set
I'd like to set a date for this week?,set
"Olly, make a calendar entry for next Saturday at ten a.m., please.",set
repeat daily,set
Please make a reminder for Friday at 6 p.m.,set
13th june is a day of election result.plz. set it.,set
save this event,set
quality of sound check,set
Set alarm for 1 hour from now.,set
set alarm at 2am,set
Set 12 noon prayer for every friday,set
Add event with .. and ..,set
hi to all,set
New reminder at 3pm,set
Olly mark 1st january as new year event for every day,set
set alArm,set
Could you please schedule a meeting with this person,set
"Note to self:saturday 16th of March, 8:00, Valia's wedding",set
Put a 7pm meeting time down for March 14th,set
"I have a meeting tomorrow at 2pm with John, put that in my calendar.",set
Add a notification reminder and calendar event for Thursday at 7:00 AM labeled Sales Meeting please,set
My daughter's anniversary is Thursday.  Send me a reminder,set
"I want to add a lunch date with mike, jim, and bob",set
set alarm reminder for calendar,set
Set a reminder for gymnastics every Wednesday at 3.,set
calendar event,set
Remind me of my meeting on Wednesday at 9 am.,set
make appointment for next friday,set
Olly set 21st april every year as dad's birthday,set
latest reminder about meeting,set
I want to add something to my calendar.,set
Repeat this event,set
Set new alarm on 5 am,set
Mark tuesday for a meeting with John.,set
alert me at 3pm to goto the concert,set
remind me to check the oven in 15 minutes.,set
Echo I need a reminder for tomorrow for Joe's party after work.,set
I have practice at Wrigley tomorrow at 6,set
make an alarm for 4pm,set
PDA if there is any free space please set a reminder for me to call my sister about a college fund between my meetings this evening.,set
I need to meet with debby tomorrow alexa,set
I need an alarm for 9pm.,set
Block one hour from 10 tomorrow morning.,set
Olly remind me my mom's birthday a week before,set
Create a calendar event with Mike and Jo at 6 o'clock [date : tomorrow] morning departing for Muscat,set
"Hey Olly, Please set a reminder for tomorrow morning 10 am meeting",set
Remind me at the 15th of every month.,set
please set an alarm for me 9a,set
remind me before monday.,set
Please give me notice when I need to leave for the conference,set
Set the event to recur every week,set
olly make sure to remind about tomorrows afternoon meeting,set
Remind me to meet Sarah at Safeway in Mckinleyville California at noon.,set
Remind me to make a pizza tomorrow morning,set
Remind me to 'something' in 'sometime',set
remind me in time to do thing,set
Turn on alarm 30 minutes before liverpool started to play,set
Show me the events in my work calender for next week.,set
Set the alarm for [date : tomorrow] 5am.,set
remind me about calendar,set
Remind me about my meeting with Joe at 10 on Monday,set
Remind me of my meeting tomorrow at 3:00PM,set
"pencil me in for sarahs birthday thing on the 12th, PDA.",set
reminders for doctor visit,set
"Olly I want to go to the outdoor movie screening this weekend, remind me",set
"I want to do X thing every day, please set a reminder.",set
Please remind me about the 11am business meet,set
Set a timer for 5 minutes for cookies,set
please remind me 1 hour before the meeting I hace tomorrow morning,set
I need an alarm set for 8am,set
Add my practice at King's Park on Feb 4 at 2 p.m.,set
Remind me to get laundry done [date : tomorrow] 7 PM,set
please mark the date 1/2/2017 and set the reminder at 5 pm  to make an appointment with mr. Richard.,set
invite jack for meeting tomorrow,set
"i need a reminder for ,my 5pm meeting",set
'exhibition 2017 mass' on Mar 25 make a note of it on the corresponding date.,set
Set the reminder for upcoming meeting,set
Hey Google can you save next Monday night for my date with Carl.,set
Set reminder for 7 am for the City Team Meeting.,set
Add this event to my calendar,set
"PDA, notify me about the event in my calendar.",set
Remind me the night before my doctor's appointment.,set
Please alert me on Friday at 8:00 am to go to the gym.,set
Could you remind me to take the bins out on thursday,set
I need you to mark next monday,set
Will you mark that I have a meeting with tom at 3 tomorrow.,set
Set up recurring date on my calendar,set
"PDA, set a doctor's appointment for 3:30 PM, March 7th, with an alarm thirty minutes before.",set
Add remember to call Mom to my reminders.,set
I need to calendar a meeting with Nathan on Monday at 9am.,set
May 2 is Mary's birthday,set
remember me my child's birthday,set
add new event named anna to calendar,set
Remind me to send the presentation today at 1:00pm,set
It's Lee's birthday on 22 June.,set
COULD YOU REMIND ME TO TAKE MY CAR FROM GARAGE BECAUSE I MAY GO FOR A LONG DRIVE.TODAY .,set
create a meeting with friend,set
set an alarm for 2pm,set
Alert me at 2:30.,set
PLEASE TELL ME TO TAKE MY UMBERALA BECAUSE IT WILL BE VERY HOT TODAY.,set
please set a reminder for my 5pm meeting today,set
set alarm on 25th may at 5 pm,set
Set meeting with Joanna on Saturday 4 pm.,set
Send me an alert and hour before my next appointment.,set
Alert me at  0500 hrs,set
Set an alarm for the meeting tomorrow 30 minutes before the event starts,set
Set reminder for atleast 20 times for this calender event which i svery important,set
Set reminder for meeting with Mitushree on 04/04/2017,set
Would you please notify me about the event in my calendar,set
olly remind me i have a meeting at 7pm,set
wake me up at eight o'clock,set
Fill my calender with a meeting with Garvin and Trilly for December 5th  at 5:30 p.m.,set
Olly remind me about the picnic at Regent park,set
I want my PDA to tell me when a new anime season will come out,set
on 23rd feb rahul will come with me on india cricket match.,set
Can you set an alarm for 7 am?,set
"Every other Wednesday, remind me to go grocery shopping.",set
place alarm at 5 o'clock morning,set
Please add supervision to my calendar,set
fix an alam,set
"I am having a meeting on tomorrow, set it",set
PDA name: make an alarm for 5pm on tuesday,set
please set a notification on 23rd october about meeting with my colleague,set
"Alexa, give me my to do list for today",set
Add Yoga class at noon to my schedule for the next three Sundays.,set
yes its must,set
google calendar. add event for march 21st,set
Please add this event to my calendar,set
Add 'meet with Dave' at Subway on Weber on 4 April at 5pm.,set
put monday meeting on calandar ever monday,set
Make a note to pay the electricity bill and remind me on Saturday at 9:00 a.m.,set
Add payday to my calendar for every other Thursday.,set
Remind me to look at the pasta in 30 mins,set
set up notification for meeting,set
I need to add an event on May 5th 2017 location Goshen for Danny's Graduation Party.,set
Set a reminder for 15 minutes to change laundry loads,set
Turn on an alarm for 3:30pm today,set
remind me about the meeting,set
Activate a 1 week notification before my anniversary please.,set
set calender for date and time with this person,set
Put my dinner at Red lobster on the calendar for today at 9.,set
I need you to set an alarm.,set
Remind me to do something then,set
Set an aniversary event for Tuesday,set
Remind me on monday at 2PM to have a meeting with Andrew.,set
"Please put the following event in my calendar on this date, and then place it in the calendar every week thereafter.",set
i finished it once,set
add TAL meeting this thursday to calendar,set
can you set the alarm for 1:30,set
Set a notification for my 12pm meeting 15 minutes before,set
Please set an event at 10 am one month and two days from now to have a garage sale at my house,set
Remind me about the upcoming national holiday.,set
Create meeting with Paul tomorrow at 6 pm.,set
Set phone to vibrate for a reminder 5 minutes before my next meeting,set
Make an alarm to help me remember,set
Create a new event every friday at noon,set
Please add a 4 p.m. appointment for every Tuesday.,set
Set calendar reminder for noon titled lunch meeting,set
Meeting at 8am to 12pm,set
Set a reminder i need to wake up at 5 Am every morning,set
Remind me of my dentist appointment the night before.,set
Please set repeating reminder for my friends birthday on April 5.,set
Remember dinner on Thursday at Bistro Italia.,set
Tell me when i have a work meeting coming up?,set
"Make a calendar entry for brunch on saturday morning with Chris, Kimberly, and Aaronson",set
"Remember to pick me up by 12 noon from the Airport, I have a 3 pm meeting.",set
"In the calender, put that we are having dinner with Frank at eight p.m. on the ninth of August.",set
Schedule a reminder for 1pm for a board meeting,set
PDA please set this date to repeat,set
Add repeating event on Saturday on 7 am named cinema time,set
set a remainder for 12 pm for lunch,set
Set alarm for this event reminder repeating for 10 times.,set
PDA can you remind me to go to the corner store on Tuesday.,set
remind me at location,set
All RCCG March event is to be added to my calender,set
Remind me to call my grandma this Sunday,set
I have a event 8'O clock remind me,set
olly add my upcoming meeting to my calendar,set
Can you set a reminder for Wednesday at 1:00PM for my meeting?,set
Arrange a meeting on Monday,set
Mark on my calender,set
Turn on my first scheduled alarm,set
Add event with these people,set
alarm time for 12pm,set
Set aside this day for this calendar event,set
alarm,set
MAKE A NOTE THAT I NEED TO CALL JANE LATER,set
Save [event] for [date],set
Please set an alarm at 6 am.,set
Please give me a 2 hour warning before next Saturdays meeting.,set
Set an alarm for 1 hour from now,set
Buddy adding event in your calendar,set
Remind me every friday to go to my son's basketball game,set
remind me tomorrow at 10am about the meeting,set
Create a new event on my calendar,set
Set a birthday event for Wednesday,set
start alarm,set
Remind me about the office meeting tomorrow at 7,set
New alarm for 6am,set
Remind me tomorrow at 4 about an event,set
put a repeating event on the calendar,set
Add birthday reminder on September 4,set
Echo I want an alarm for 3:00 today.,set
"Olly, set a reminder for my meeting today.",set
Schedule meeting with Laura,set
send a notification to friend,set
"I have to be in hawaii for this upcoming event, can you add this?",set
I'm going to the OAR concert in Paris on March 24,set
remind me at the time of the event,set
Remind me everyday at 2 PM for lunch,set
Schedule meeting on,set
Remind me in the morning to call my mother.,set
meeting this monday,set
Please remind me of all the NBA scores in a week,set
"Hey Olly, turn on your reminders for tomorrow's meeting at 10 am.",set
Set a reminder for this,set
Google set my alarm to go off in an hour.,set
Get me up in half an hour,set
olly put tomorrows golf tee time on the calendar,set
Meet with Joe tomorrow at 3,set
Set up a meeting with Peter Francis for Monday at 2 pm.,set
I need to get up at 7:00 am.,set
Set up a meeting with my Tanya for every Thursday at 10 AM.,set
Set up an event recurring throughout the month.,set
Remind me about the March 16 meeting.,set
attend party with Love this friday,set
TOMAROW WILL BE CONDUTING AN MEETTING IN REQUIERD MANER,set
Create a new daily event.,set
avinash go with me on 5th april movie commando.,set
Wake me up at 6:30,set
Send me a reminder of my meeting with Tom next Friday,set
"PDA, Set an 8:00 AM alarm for next Tuesday.",set
Add Joe Smith to my calendar for today at 1pm,set
Remind me 30 minutes early that I have a teleconference on Tuesday,set
please set on 8th july there is music concert in white field,set
I need an alarm for <insert time> can you please set one for me,set
Please add (event) to calendar,set
Need an alarm set for Sunday at 5 in the morning,set
Remind me every Monday to take out the trash,set
alarm for 10am,set
mark today as the start of my diet,set
get ready for the upcoming meeting before the given time,set
Set an alarm for 9PM,set
Please set a reminder in my calendar for my meeting on March 25.,set
Before this event set notification,set
create an event with location 'home' and with event 'new year's eve',set
please set the alarm for next morning to 7 am,set
Make a schedule for meeting with our customer next week.,set
Remember me to meet Reveca today at 6:00pm,set
remind me of my meeting with Ms. Boland on Wednesday 8:00am on Tuesday 7:00pm,set
set a birthday event for martin,set
"Please, put to my calendar daily standup to 10am",set
Reminders,set
Remind me about the meeting tomorrow at 6,set
Remind me to pick up the laundry next Monday,set
I need a meeting to be schedule with this person,set
"Olly, notifiy me two hours before my meeting.",set
Put me down as busy on my calendar from 2-3 pm on Wednesday.,set
Please remind me of,set
set an appointment for Allen on tomorrow,set
remind me to get milk [date : tomorrow],set
include MIke and jack to festival calender,set
remind upcoming meeting with eminem,set
notify me with all events in the next one week,set
Set a reminder to notify me 1 hour before lunch meeting,set
"Olly, please set lunch meeting at 12pm for every Wednesday in March.",set
Please let me know about a meeting after  days,set
Postpone my alarm by 15 mins.,set
Please sound an alarm three hours before a scheduled event.,set
Please set an alarm at 4.00 am [date : tomorrow],set
olly i need next weeks lunch put on the calendar,set
I need to arrange a meeting with Jack.,set
notification of meeting on Wednesday,set
Please add concert at summerfest to calander,set
family date this monday,set
Mark the event monthly,set
hayathis daughter baby shower,set
Open memo add note about my meeting,set
Add to calendar every year on May 2 is Mary's birthday,set
"I want you to schedule a meeting with Bryce, Jessie, and Carol for tomorrow at 9 am.",set
set the event name to ____,set
Please schedule a meeting with my secretary,set
Remind me in the future of this,set
Set an alarm for me for <insert time>,set
Place a birthday party with Alex and Amy in my calender.,set
Oliver will send me an email on Thursday and please set up a calendar appointment for our meeting based on the date he will provide on that email.,set
Add reminder today evening to collect the parcel from Jakes bristo,set
alexa set an alarm for 4pm tuesday,set
set an alarm for 1pm,set
remind me that I have to go see Hannah about our math project next Tuesday at 10pm,set
Remind it on Tuesday.,set
Remind me to call the bank next Thursday,set
Remember [event] for [date],set
set repeating reminder for every sunday,set
add date and time in calender with these people,set
Please enter in my calendar an appointment with Dr. Branden for this Friday at 6 pm.,set
Add a reminder to my calendar every year/month/week on this date,set
Jack birthday is on 15th march set a reminder,set
notify me about any festival occurring next month,set
olly add tomorrows dinner date to the calendar,set
Set the alarm for 9am on weekends.,set
Just let me know the important appointments with dealers over the week,set
Mike and Jack should be added to festival calender,set
remind me that i have a meeting with cassy for an ola Event happning tommorow.,set
can you add to my calendar an event for next friday,set
Set a reminder of birthday of jack on 15th march,set
please add the meeting with Ms. Boland on Wednesday 8:00am to my calendar,set
create repeating event 'john's birthday' on calendar,set
Lets get something on the calendar for Tuesday,set
Remind me to MOVE [try to new exercises] so there is no weight gain,set
"Alexa, remind me daily about Inauguration Function",set
Set a reminder for the meeting Friday at 3 p.m.,set
please set event on Tuesday,set
"Calendar event. send invite, Bill Malinda",set
Don't forget to remind me of my brother's birthday on April 20.,set
"Olly, I have scheduled a meeting with Mr. Ross this Friday. Mark it in you calendar and remind me on Friday early morning about it.",set
Set an alarm for tomorrow at six in the morning,set
search calendar and set meeting on January  25,set
Remind me about the meeting in 1 hour.,set
Set a reminder for a meeting at 2pm tomorrow between myself and John.,set
add John's birthday on 25 March,set
set reminder for meeting....,set
on january 25 set meeting for XXX,set
Set a reminder for Wednesdays at 2 p.m.,set
create new event on calendar 'john's birthday',set
Set alarm for 6:00 a.m. tomorrow.,set
Set an alarm for ten o'clock tomorrow morning.,set
"Ok Google, schedule a meeting with the creative team [date : tomorrow] at 1pm",set
Please remind about the [date : tomorrow]'s schedule,set
"Hey Olly, send a meeting invite to Mr. Ross for this Friday's meeting and block my calendar for Friday afternoon.",set
Please modify my calendar with this event.,set
reminders for card payments,set
Click Save.,set
send apologies to all the attendees of the upcomming Tavern lunch,set
Remind me about my Monday meeting with Peter Francis fifteen minutes before the meeting.,set
Please remind me to go to the post office.,set
please create a new alarm,set
set an alarm at 6 AM [date : tomorrow],set
Notify me when this happens,set
"THERE ARE MANY IMPORTANT EVENT IN THIS MONTH, NOTE DOWN THAT.",set
Give me a reminder 24 hours before my Friday meeting with EDG,set
Make March 18 a repeating appointment for Pearl's birthday.,set
please create an event with only these people,set
Make a new alarm.,set
i need a event to be created with only these people,set
I need you to set 12 noon prayer for every friday,set
Pleas set a reminder for a meeting I have on Tuesday next week.,set
Please reschedule the meeting to 6 pm tomorrow and inform members.,set
set event date in calendar with ohers,set
Set reminder notification for three o'clock,set
Set my alarm for Tuesday at 6pm.,set
remind me to eat when i get home,set
do events,set
Set the alarm to 7 am for work,set
"Set a notification for three, two, and one hours before next week's English final.",set
Make sure to call the babysitter for date night on Friday.,set
Schedule a meeting with Reeta today evening at 5 PM,set
can you add my brother's birthday dinner at rusk for march 23rd,set
upcoming meeting,set
Remind me that I have an appointment 12 o clock on saturday,set
"Olly, add dinner with Jane on February 12th at 6pm.",set
Set soccer game with Mark in my calendar for Tuesday night.,set
Remind me of my meeting tomorrow 10:00 in the morning.,set
Please set a reminder for Tuesdays at nine a.m.,set
Schedule a meeting with Matt at 11am on Thursday.,set
12th July is Bola's birthday and my calender to be updated with this date,set
Please remind me to take off coffee off stove in 10 minutes,set
set an event for friday,set
Schedule a meeting with Al on Tuesday,set
Please set recurring calendar event.,set
Send a notice to the me and a group members reminding us of the new date for the meeting.,set
notify all birthdays next week,set
I want you to remind me about the evening program,set
remind this after two days,set
Set an event,set
Add an event for July thirtieth named birthday.,set
Notify me the day before the horse race at Santa Anita on March 7th.,set
