clear events from calendar,remove
Erase the chore list.,remove
Remove the alarm set for 10pm,remove
Remove events.,remove
Remove my dinner event for Monday.,remove
Delete my list of appointments for tomorrow,remove
Remove Mike Stein from Contacts list,remove
Olly delete my appointment for tomorrow at three p.m.,remove
Delete all the events in my calendar.,remove
"Kickball is over, I do not need the alarm for kickball on Wednesday evening, any longer.",remove
delete,remove
Clear all events for this month.,remove
Cancel appointment with dentist [date : tomorrow],remove
cancel event,remove
Remove my shopping list,remove
Clear all items on my calendar for April,remove
Delete the party on June 1st from my calendar.,remove
delete next event,remove
Remove all upcoming events please.,remove
Please remove all the movies I have watched on my favorites list.,remove
reset all events in calender,remove
Turn off the alarm for tomorrow morning,remove
Remove my 1:30 appointment.,remove
Please delete x,remove
please restart and remove all the entries in the calendar.,remove
Please remove my next event,remove
please remove event name,remove
Erase all events on the calendar.,remove
Take that off there,remove
Remove cereal from my shopping list.,remove
Find and delete all of my weekend events with Evan Parker,remove
"Olly, erase all.",remove
"Alexa, remove the event from Monday.",remove
"Siri, cancel all soccer practice alarms",remove
Please clear Jeff's birthday from the calendar.,remove
Remove all my engagements from calender for [date : tomorrow],remove
Can you delete my shopping list.,remove
choose calender,remove
please delete this item,remove
remove my task list,remove
Make my calendar empty,remove
Delete my 8 pm alarm.,remove
"olly, cancel all events in the next two days",remove
COULD YOU PLEASE REMOVE MY CARD DETAILS FROM VALLET.,remove
Clear this list,remove
"Change my plan, erase my next event",remove
send an email to a new address,sendemail
Send email to new email address,sendemail
forward email,sendemail
respond to the mail of ash in morning,sendemail
Could you please send and email to my friend Susie letting her know I won't be at church tomorrow?,sendemail
Send an email to guy selling the boat telling him that I have the money,sendemail
Send a reply to this email.,sendemail
respond to all that I am on my way,sendemail
compose email to a new address,sendemail
Reply to the email received from Jennifer,sendemail
Send an email to jeff at gmail dot com,sendemail
Send an email to Scott asking what the weather will be like this week.,sendemail
I want to reply to this email.,sendemail
Can you send an email to 234234@fsdfsd.com?,sendemail
add this new email to my contacts,sendemail
Email my friend about our plans tonight,sendemail
Please send an e-mail to Larry's new e-mail at XXXX@gmail.com,sendemail
"Please say to the email that sent me George, i need the money now. Its urgent",sendemail
Can you send an email to (name),sendemail
Send an email to Mom tell her I love you,sendemail
Let's send an email,sendemail
"Alexa, send mom the following email",sendemail
start a new email to:,sendemail
Reply to the email,sendemail
send an email to fred from work he is in my contacts,sendemail
Send a reply to Robert for his email received today morning.,sendemail
Send an email to Sarah about brunch today.,sendemail
Email to my family saying I love you all,sendemail
email tom,sendemail
Reply to Anthony's email,sendemail
Email co worker about work project,sendemail
Compose email for Robert.,sendemail
New message to newmail@gmail.com,sendemail
send a confirmation email to sandy,sendemail
Type an email for me please.,sendemail
Please reply to my most recent email.,sendemail
Send an email to grandma saying we are dropping by on Saturday. See you then!,sendemail
"PDA, please compose a new email to coworker.",sendemail
Send an email to my family telling them about my upcoming birthday plans,sendemail
Reply to the email received from Mark,sendemail
send email to jim,sendemail
send email to current email address,sendemail
write this message to the coworker group.,sendemail
I need to send a reply to Charlotte,sendemail
Can you email Mary and let her know I am on my way?,sendemail
Answer email,sendemail
mail x@x.org,sendemail
"PDA, send an email to Stan Francis",sendemail
Send a response to my last email.,sendemail
hi buddy send mail to my friend hellen regarding home builders are not accepted the offer,sendemail
Send email to Gary,sendemail
Email my meeting details to my manager,sendemail
Forward the concert dates to Jerry by email.,sendemail
Email Susan and write that,sendemail
Will you send an email to this new email address?,sendemail
Add a new email for Julie Smith.,sendemail
Create e-mail to Yulia,sendemail
Send an email to my family asking how they're doing,sendemail
Make a reply to the email which Robert sent today morning.,sendemail
Reply to the email from my bank and inform them that I have paid the credit card dues.,sendemail
"send email to daddy, i'll be going to the birthday party.",sendemail
Please reply to this email.,sendemail
Drop (sender) a line,sendemail
"Alexa, reply to the mail with the following content",sendemail
send mail x@x.org,sendemail
Please draft an email to Shaun requesting Sunday's off for the next schedule.,sendemail
new mail to mom,sendemail
Email my boss that I will be late today because of an emergency and apologize to him for missing the meeting.,sendemail
PDA shoot Dale an email response warning him about the gulls at the beach.,sendemail
prepare email for susan,sendemail
"reply to last email, say 'sorry cannot make it'",sendemail
Send to Jane only help,sendemail
Start a new email to George Brown,sendemail
Please open a reply to the email.,sendemail
Google I need to answer that last email.,sendemail
PDA please start an email to Jesse.,sendemail
Send email to Mom starting with the subject: Vacation.,sendemail
send an email to mike about this weekend party,sendemail
Compose an email to (name),sendemail
Send an email to Ray,sendemail
Pull up Kate's email and write that I will let her know.,sendemail
Send an email to the newest address added to the address book.,sendemail
"send email to Enalen, i'm going to send the files the next day.",sendemail
send email to mommy that i'll be going the party.,sendemail
Locate Jen's most recent email so I can reply,sendemail
I need this e-mail sent now,sendemail
Send email to Yulia,sendemail
Send a Hi to test2@gmail.com,sendemail
open the recent mail of Allen and replay for it,sendemail
Please send an email to the following email address <insert address here>,sendemail
Look up contacts,sendemail
Start reply,sendemail
send email to my uncle about situation of current weather.,sendemail
Send an email to Bill that I'm sorry I didn't realize he was so sick,sendemail
shoot an email to chris about work tomorrow,sendemail
"Open email to new person, please.",sendemail
"PDA, send the email to this new email address",sendemail
Prepare a reply email to Mark.,sendemail
Send an email to my mom.,sendemail
send 'thank you so much mom' to mom,sendemail
Please respond to the email I just read.,sendemail
this new email should be added to my contact,sendemail
write an email to my family saying I love you all,sendemail
hi send i love you message to my wife,sendemail
sent to,sendemail
send email to Chris with following content,sendemail
Will you send the email to Greg?,sendemail
"mail administrator,",sendemail
Add new email address and send email,sendemail
Send an email to my boss saying I will be late.,sendemail
Send an email to mom asking for a weather update on the week to come.,sendemail
Reply to Beth's email tomorrow by telling her I wont be late,sendemail
Send a birthday email to my boss,sendemail
send this content via email,sendemail
reply to last received email,sendemail
Email Jake a calendar invite for dinner on Sunday,sendemail
Create an email to my brother asking him what time he will be over for dinner.,sendemail
Send an email to Margaret.,sendemail
write an email,sendemail
Send an email to my friend say birthday wishes,sendemail
All emails received between 10pm and 9am is to be replied to.,sendemail
delete this email,sendemail
Send Danielle an email.,sendemail
email gary,sendemail
Send and email to mom to tell her Wyatt's birthday party is on Sunday,sendemail
Email Chelsea,sendemail
write email to my company mate to submit the task tomorrow.,sendemail
email my contact with the following message,sendemail
Would you open the email and I would like to compose a new one,sendemail
Write email to family member and read it back,sendemail
Reply to Erins email by saying I will be on time,sendemail
send email 'thank you very much' to sarah as a reply,sendemail
use email to let chris know i will be late,sendemail
I need an email to be sent to comcast.com about my service issues.,sendemail
Please send the email to Jeff.,sendemail
The email reply should state,sendemail
Open my most recent email and reply,sendemail
Please sent this email to my friend,sendemail
send response I will be there,sendemail
open terry's email,sendemail
write an email to john (body),sendemail
email received reply,sendemail
Send email to Bill asking to reschedule,sendemail
"You can send the email to abc@gmail.com, this is my new email address",sendemail
Please send Mom and Dad an email asking how they are.,sendemail
Reply email to Charlotte,sendemail
I want to reply,sendemail
jjj_india@yahoo.com,sendemail
send email to my wife,sendemail
send mail to ismail for office opening time table.,sendemail
reply to new email from joe,sendemail
Send an email to all my co workers,sendemail
Send to Sandy J....unable to make it to lunch today can we reschedule?,sendemail
Send the email to John.,sendemail
write and send email to friend Cindy,sendemail
Reply to all emails received from 10pm to 9am,sendemail
Draft response to John's email,sendemail
Send an email to my boss and attach the presentation file with it. Apologize for being late.,sendemail
Send email to family and tell them graduation is scheduled for 6PM on Saturday and accept or decline the calendar invite,sendemail
"Email Grandma. Subject, Saturday. Message, we are dropping by on Saturday. See you then!",sendemail
email _____,sendemail
Send answer to George.,sendemail
send email to [spell out email],sendemail
Respond to email,sendemail
Please send an email to John saying I'm on Leave,sendemail
KYA TUM MERE FRIEND KE PAAS EK EMAIL BHEJ SAKTE HO.,sendemail
Reply to Christy's email and say Thank you very much,sendemail
send an email to my manager,sendemail
send email to joanne@aol.com and add as new contact,sendemail
deaft an email to kailey about work later,sendemail
sarasigmon123@gmail.com,sendemail
PDA: I want to reply to Bob Smith's email,sendemail
Send email to family and tell them to bring the bug spray before coming to the park,sendemail
Send email to Boss Not feeling well taking a sick day,sendemail
compose reply,sendemail
Please reply to my boss' most recent email and say that the ppt will be ready in one hour maximum.,sendemail
PDA: Add Bill's email to my address books and lets send him a message,sendemail
New email for contact,sendemail
send an invitation email to marilia,sendemail
Please send an email to (name),sendemail
send a group mail to lookafter,sendemail
I want a reply to the email,sendemail
Send an email to this contact rede43@oby.com,sendemail
There is an e-mail I need you to send my friend,sendemail
Send Dad an email saying how is the weather this week?,sendemail
forward a mail to sandy,sendemail
Write an email to Luke asking how the weather will be this coming week,sendemail
Reply to recent emails.,sendemail
Respond to my bosses email with the word that I will be in at 4 in the evening.,sendemail
Send this reply to received email,sendemail
send that,sendemail
I want to send an email to... that says...,sendemail
Please send a reminder email to Peter and ask him how long he will be taking to prepare the presentation ppt.,sendemail
Please send a voice mail to Mr. Richard office about meting him on 1/2/2017 at 5 pm.,sendemail
send this message to the family group starts with A .,sendemail
"Hey, email Jan about our meeting",sendemail
reply yes to this,sendemail
Email Ashwin Patel my best wishes and an attachment of work.pdf,sendemail
Answer email from Sally.,sendemail
send an email to dad how is the weather this week?,sendemail
reply wishes to john by email,sendemail
semd email to my contact,sendemail
Reply with [email response].,sendemail
Send email to boss to meet for performance review,sendemail
Send an email to qerwerq@dfasdfa.com,sendemail
Forward email address to my new email,sendemail
I need to email Susan and metion,sendemail
email friend,sendemail
I have a new contact: newmail@gmail.com. Compose mail!,sendemail
Open a reply message,sendemail
send john a mail for financial report 2017,sendemail
Reply to the email received from Peter,sendemail
here is a new email address to be added to the contacts,sendemail
"I have a new email address, can you send an email?",sendemail
PDA: Reply back to Bob Smith...,sendemail
Please send an email to Uncle John telling him that I will be there.,sendemail
PDA send email to Carl that I will be late for work tomorrow.,sendemail
Email my boss that I'm coming in late today.,sendemail
send a replay email,sendemail
I'd like to send a reply.,sendemail
Please send a business email about the time of the meeting change to Lauren.,sendemail
Please send an email to Sally regarding tomorrows meeting.,sendemail
"New email message, to Robert Peck, Late from work, send",sendemail
"PDA, Can you send the email to the new email id?",sendemail
mahaboobsayyad@gmail.com,sendemail
Schedule text messages for later.,sendemail
Send email to mom asking about the weather.,sendemail
"Olly, write a reply to my mother's email.",sendemail
run reply to latest email received,sendemail
Send Mom an email about the upcoming weather for the week.,sendemail
send a reply to mike,sendemail
Send email to Joy Hey I missed you yesterday want to go out for dinner tonight,sendemail
put a mail to sandy,sendemail
Send email to Robert.,sendemail
send email to Chris tell him i will be late,sendemail
"reply to Dad, write 'I will be late'",sendemail
All emails received between 10pm and 7am everyday is to be replied.,sendemail
send an email to 'rohit' saying 'I am busy tommorrow',sendemail
Email John saying I'm on Leave,sendemail
email joejoe@gmail.com,sendemail
Please send pedro a email about his car,sendemail
"Reply the email of Charles with just thank you, right now",sendemail
"Olly, email Alice to let her know we are on the way,",sendemail
how we calcultate,sendemail
Please send the email to abc@gmail.com instaed of xyz@gmail.com,sendemail
Now I need to write an email to my colleague,sendemail
please email my team,sendemail
Olly that last email needs to be answer asap.,sendemail
My mother needs the weekly weather sent to her.,sendemail
Send email to Anthony.,sendemail
send and email to the survey group regarding answers,sendemail
Please send email to Liz,sendemail
write SMS to our friends,sendemail
reply to Patrick that I am on my way,sendemail
"Alexa, send mom an email now",sendemail
Please Send an email to toms principal in regards to the meeting we have tomorrow.,sendemail
"Alexa, email mom and ask how the weather is there",sendemail
dictate email,sendemail
Email George Brown,sendemail
I would like to reply to the most recent email.,sendemail
send voice email,sendemail
"Email to Matthew with content: Project finished, send me invoice please.",sendemail
Help is to be sent only to jane,sendemail
Send an email to my sister,sendemail
Reply to John's email today saying I will be late,sendemail
Reply to this please,sendemail
Send an email to my wife about next week weather,sendemail
I want to start my e-mail out like this:,sendemail
send email 'how are you dad?' to dad,sendemail
Send email to Rajesh,sendemail
Start email to client...,sendemail
Send mail to Bubbles. I want to meet her tomorrow at 2 PM in office.,sendemail
PDA send email to comcast that their service sucks.,sendemail
send John Smith and email.,sendemail
email 'happy new year' to john,sendemail
PDA please respond to Greg's email stating that his idea is fantastic.,sendemail
send email to Naty,sendemail
PDA please write to this email,sendemail
Respond to the email from John Doe,sendemail
Write an email about next week weather to my wife,sendemail
Alexa start email.,sendemail
reply to joes email,sendemail
Send an email to John that I am on my way to home.,sendemail
Get in contact with (sender) on email,sendemail
Email Karen about the budget meeting,sendemail
"Send an email to Mom, asking if she was able to order the book from Amazon that I told her about.",sendemail
"I did not want you to send that text yet, wait until I say send.",sendemail
reply to that email,sendemail
i want to send email to my friend jack@gmail.com,sendemail
send email to daughter,sendemail
how we can get credit,sendemail
"Send email to Emilia saying: I will be late, please don't wait with dinner.",sendemail
Send an Email to my mum that I will visit her next weekend.,sendemail
Send the email to Jill that is saved in my drafts folder.,sendemail
reply mail,sendemail
Send email to joe@aol.com,sendemail
Send email to newmail@gmail.com,sendemail
Send an email to my boss about my leave,sendemail
send a message to bill@mail.com,sendemail
pass the following using email to,sendemail
"HEY, I WANT TO SEND AN EMAIL TO MY FRIEND.",sendemail
Please send the email to my mom,sendemail
Reply to this email,sendemail
sned email to daughter saying I love you,sendemail
email john (body),sendemail
"PDA: I need to send a new email, here is the address and then add it to the contact list",sendemail
reply to the latest email,sendemail
Send email to liz,sendemail
Send an email to Joe that says I'm already here,sendemail
Send email to new contact,sendemail
send a reply email 'thank you very much' to john@gmail.com,sendemail
Send an email to Jake to tell him thank you,sendemail
send an email to john (body),sendemail
send email to Martha saying last evening was wild,sendemail
Send new email to jana dot litt at gmail dot com,sendemail
I need an email to be sent to comcast.com about my service issues.,sendemail
"Write an email, recipient, Ray.",sendemail
Reply to Heather's latest email by answering No,sendemail
email my favourite contacts,sendemail
send email to family saying I love you all,sendemail
"Olly, send an email to James asking when he is getting off of work.",sendemail
"Compose a new email, but I got a new address this time, brandon at example dot com",sendemail
send an email to my supervisor,sendemail
"Alexa, I want to check Julia's available dates, so would you send her mail and ask about it?",sendemail
Send help only to Jane,sendemail
Send a reply to the last email.,sendemail
Send a mail to mike. Tell him we will meet today 7 PM for dinner at Coffee House.,sendemail
Send email to my brother,sendemail
I'd like to send an email to the new receptionist's email.,sendemail
go to contacts and enter a new email address,sendemail
Send email to jugal,sendemail
Create email to John start body I am interested in seeing the car you have for sale can we schedule a time to meet? Send,sendemail
I need to add a new email to my contacts.,sendemail
"Alexa, create an email to mom and ask about this week's weather.",sendemail
send a mail to Alex asking about the due payment.,sendemail
email the following message to this contact please,sendemail
send mail to sanantha about body exercise schedule.,sendemail
send email to rohan to meet me today at evening.,sendemail
will you write an email to Chelsea for me,sendemail
lindafancy55@gmail.com,sendemail
Send an email to Frank at work.,sendemail
sent email to,sendemail
Please load new e-mail for Bruce and send message now.,sendemail
go to email and send message to,sendemail
Just let me know next weeks weather in California,sendemail
hi google pls send mail to mom i am comin home on this weekend,sendemail
How do I add a new email to my contacts?,sendemail
Open reply,sendemail
Send an email to Peter and ask him how is he now. Can I do something to help him.,sendemail
send email to joseph@gmail.com,sendemail
Reply to all emails received between 10pm and 7am everyday,sendemail
Send email to...,sendemail
Please send an email to <email address>,sendemail
please send a mail to Mr. richard  stating that i going to met him on 1/2/2017 at 5 pm at this office.,sendemail
forward the mail to new e-mail address,sendemail
reach by mail to my family.,sendemail
email rohit saying 'I am busy tommorow',sendemail
send email to [name] saying .... [contents],sendemail
Reply to most recent email,sendemail
Email dad how is the weather this week?,sendemail
will you help me write an email to Chelsea,sendemail
replay this mail.,sendemail
compose a reply to last email,sendemail
link 'john@gmail.com' to 'john' in contacts,sendemail
"Please send an email to Uncle John with the following: Yes, I can make it.",sendemail
Compose email to my mom...,sendemail
can you send email to my friend rohit which says 'I am busy tommorrow.',sendemail
Send a reply to that email.,sendemail
pls send a mail to my hubby i will late tonight,sendemail
Forward email to liz,sendemail
Answer Paul's email.,sendemail
please reply to the email,sendemail
Echo I just got an email from Bill I need to answer it right now.,sendemail
Enter new address in email form.,sendemail
Reply to my email from Sasha saying thanks.,sendemail
reply back to this email,sendemail
Send mail to Mom. I am planning vacations with her nest week.,sendemail
"Hey PDA, Send email to...",sendemail
Email my mother.,sendemail
Respond to jack quickly,sendemail
"add mail id, subject , content",sendemail
Reply to all,sendemail
I need to reply to this email.,sendemail
mail send to ashok,sendemail
tell chris i will be late through email,sendemail
Respond to mom's mail message about the recipe site.,sendemail
send this emai to reply to the latest emails,sendemail
Send a reply to Mike with the answer 4:30 from his email he sent this morning.,sendemail
I need to send an email to Laura.,sendemail
Text Sarah if she is free for brunch today.,sendemail
Email John Smith.,sendemail
Please send Mom an email saying that I can make it next week.,sendemail
reply to Johns email by saying yes I can.,sendemail
Open email to send to dad.,sendemail
"HELLO, YOU HAVE A SEND AN EMAIL TO SOMEONE.",sendemail
hi send reply to victor cant able to attend meeting on 22/04/2017,sendemail
answer the email,sendemail
Send a reply to my friend for his question,sendemail
Send a test email to test3@gmail.com,sendemail
Respond to Graham and let him know that I will be free tomorrow.,sendemail
Please respond.,sendemail
I need an email sent to the following email address <insert address here> can you do that for me please?,sendemail
Send an email to peter asking him which one dress should I bring and attach the photos of dresses taken recently.,sendemail
email message to address,sendemail
Send email to husband to ask for restaurant ideas,sendemail
put a new mail,sendemail
Email to Pawel regarding latest news,sendemail
email naty for her birthday,sendemail
Add new email to contact,sendemail
"PDA, compose this email to this new email address",sendemail
email jerry regarding the meeting,sendemail
Send an email to my boss.,sendemail
Email family,sendemail
send email new address,sendemail
"Alexa, Send the mail to Robert about his availability on saturday",sendemail
PDA I need you to respond to Jennifer's email by stating we will be late.,sendemail
I need an email chain to my mother I'm planning a trip to see her ask her how the weather will be so I know how to pack,sendemail
Please email Mary and tell her I'll have her files ready in the morning.,sendemail
Compose new email to <email address>,sendemail
Send a happy birthday message to my aunt.,sendemail
"Olly, go to my gmail and click on compose. When finished, I will tell you what I want to write in the email.",sendemail
Send email to jack@gmail.com,sendemail
"PDA, send email to Cat that I will accept job offer",sendemail
Please send the new intern an email.,sendemail
Can you send an email to my mother about the weekly weather.,sendemail
send mail to john for money,sendemail
Send email to Mom and wish her a happy birthday,sendemail
Email Tom the date and time of tomorrow's meeting,sendemail
Create an email to Toby at Tobytoday dot com,sendemail
Mail my friend.,sendemail
I would like to reply to Sarah's email.,sendemail
I'd like to email Mary and ask if she wanted to meet up after work at TGI Friday's.,sendemail
Send an email to peter that where he is now and if he is at the market text him to bring some wine.,sendemail
"Send to mom..hey mom, hope you have a great day today! See you [date : tomorrow.",sendemail
create an email to ____,sendemail
send reply,sendemail
Email dad about fixing my car,sendemail
"PDA, send an email for me.",sendemail
"Alexa, My friend John has sent me a invitation card to his newly bought home. Say thanks to him in his Mail ID.",sendemail
compose an email to _____,sendemail
send a remind email,sendemail
Answer with...,sendemail
send an e-mail,sendemail
Reply an Email to Jason that I will not come tonight,sendemail
Send email to Mom - Want to go shopping tomorrow?,sendemail
Send [name] an email that reads .... [contents],sendemail
Send an email to juanpedro@gmail.com,sendemail
Please send an email to my son regarding the payment of the fees,sendemail
Respond with...,sendemail
I want to send email to jack@gmail.com,sendemail
Email form for regional VP.,sendemail
email to address,sendemail
email James about the softball game. James we need to get some refreshments before heading over.,sendemail
Send e-mail to Nancy about tomorrow's work party details.,sendemail
Save email for later,sendemail
reply email,sendemail
"Alexa, email my appointments to reschedule",sendemail
